codigo_unico,snip,fecha_registro,nombre_inversion,estado,tipo_inversion,programa_pmi,ompi,uf,uei,situacion,decreto_emergencia,cadena_funcional,viabilidad_aprobacion,costo_aprobado,beneficiarios,expediente_tecnico,reg_seguimiento,inicio_ejecucion,fin_ejecucion,inversion_actualizado,sol_controversias,carta_fianza,inver_total,costo_inversion,devengado_acumulado,avance_financiero_acum,saldo,fecha_primerdevengado,fecha_ultimodevengado,seaceobra,seaceconsul,seacebien,seaceserv
2397901,2397901,19/10/2017,"MEJORAMIENTO DEL MINICOMPLEJO DEPORTIVO DE LOS CENTROS POBLADOS DE CHOQUE, CAYCHIHUI BARRACA, NUEVA, DEL DISTRITO DE HUEPETUHE, PROVINCIA DEL MANU, REGION MADRE DE DIOS",ACTIVO,PROYECTO DE INVERSION,SI,OPMI DE LA MUNICIPALIDAD PROVINCIAL DE MANU,UF DE LA MUNICIPALIDAD PROVINCIAL DE MANU,UEI DE LA MUNICIPALIDAD PROVINCIAL DE MANU,VIABLE,NO,CULTURA Y DEPORTE - DEPORTES - INFRAESTRUCTURA DEPORTIVA Y RECREATIVA,20/10/2017,"1,878,117.00","1,739",NO,SI,01/01/2018,01/04/2018,"1,878,117.00",0.0,0.0,"1,878,117.00","1,878,117.00","836,331.4",44.5 %,"1,041,785.6",ABR-2018,FEB-2020,,,,
2398522,2398522,30/10/2017,CREACION DE LA LOZA DEPORTIVA EN EL CENTRO POBLADO DE GAMITANA - DISTRITO DE MANU - PROVINCIA DE MANU - REGIÓN MADRE DE DIOS,ACTIVO,PROYECTO DE INVERSION,NO,OPMI DE LA MUNICIPALIDAD PROVINCIAL DE MANU,UF DE LA MUNICIPALIDAD PROVINCIAL DE MANU,UEI DE LA MUNICIPALIDAD PROVINCIAL DE MANU,VIABLE,NO,CULTURA Y DEPORTE - DEPORTES - INFRAESTRUCTURA DEPORTIVA Y RECREATIVA,06/11/2017,"566,295.00",245,NO,NO,01/01/2018,01/04/2018,"566,295.00",0.0,0.0,"566,295.00","566,295.00","246,763.17",43.6 %,"319,531.82",DIC-2017,DIC-2018,,,,
2398934,2398934,06/11/2017,CREACION DE LA LOZA DEPORTIVA EN EL CENTRO POBLADO DE SHINTUYA - DISTRITO DE MANU - PROVINCIA DE MANU - REGIÓN MADRE DE DIOS,ACTIVO,PROYECTO DE INVERSION,NO,OPMI DE LA MUNICIPALIDAD PROVINCIAL DE MANU,UF DE LA MUNICIPALIDAD PROVINCIAL DE MANU,UEI DE LA MUNICIPALIDAD PROVINCIAL DE MANU,VIABLE,NO,CULTURA Y DEPORTE - DEPORTES - INFRAESTRUCTURA DEPORTIVA Y RECREATIVA,06/11/2017,"564,081.00",205,SI,SI,01/10/2019,31/01/2022,"880,734.94",0.0,0.0,"880,734.94","880,734.94","797,851.89",90.6 %,"82,883.04",JUN-2019,DIC-2021,,,"1ADQUISICION DE CEMENTO PORTLAND PUZOLANICO TIPO IP X 42.50 kgCOMERCIAL B & R SOCIEDAD COMERCIAL DE RESPONSABILIDAD LIMITADA-COMERCIAL B & R S.R.L.30-201924/12/201962,978.0062,978.00",
2400530,2400530,23/11/2017,CREACION SISTEMA DE AGUA POTABLE Y SANEAMIENTO RURAL DE CC.NN. SANTA TERESITA DISTRITO DE TAMBOPATA - PROVINCIA DE TAMBOPATA - REGIÓN MADRE DE DIOS,ACTIVO,PROYECTO DE INVERSION,SI,OPMI DE LA MUNICIPALIDAD PROVINCIAL DE TAMBOPATA,UF DE LA MUNICIPALIDAD PROVINCIAL DE TAMBOPATA,UEI DE LA MUNICIPALIDAD PROVINCIAL DE TAMBOPATA,VIABLE,NO,SANEAMIENTO - SANEAMIENTO - SANEAMIENTO RURAL,15/12/2017,"1,312,260.21",126,NO,SI,01/04/2018,01/06/2018,"1,442,233.26",0.0,0.0,"1,442,233.26","1,442,233.26","109,425.00",7.6 %,"1,332,808.26",OCT-2020,OCT-2020,,"1SERVICIO DE CONSULTORÍA PARA LA ELABORACIÓN DEL EXPEDIENTE TÉCNICO DEL PROYECTO ¿CREACIÓN SISTEMA DE AGUA POTABLE Y SANEAMIENTO RURAL DE CC.NN. SANTA TERESITA DISTRITO DE TAMBOPATA-PROVINCIA DE TAMBOPATA-REGIÓN MADRE DE DIOSSAGITARIO CONTRATISTAS GENERALES SOCIEDAD COMERCIAL DE RESPONSABILIDAD LIMITADACONTRATO N° 009-2019-MPT-GM24/05/2019109,425.00109,425.00",,
2400533,2400533,23/11/2017,MEJORAMIENTO SERVICIO DE AGUA POTABLE Y SANEAMIENTO CENTRO POBLADO DE EL PILAR - DISTRITO DE TAMBOPATA - PROVINCIA DE TAMBOPATA - REGIÓN MADRE DE DIOS,ACTIVO,PROYECTO DE INVERSION,SI,OPMI DE LA MUNICIPALIDAD PROVINCIAL DE TAMBOPATA,UF DE LA MUNICIPALIDAD PROVINCIAL DE TAMBOPATA,UEI DE LA MUNICIPALIDAD PROVINCIAL DE TAMBOPATA,VIABLE,NO,SANEAMIENTO - SANEAMIENTO - SANEAMIENTO RURAL,22/01/2018,"1,176,661.00",201,NO,NO,01/08/2018,01/11/2018,"1,231,939.44",0.0,0.0,"1,231,939.44","1,231,939.44","75,581.00",6.1 %,"1,156,358.44",OCT-2020,OCT-2020,,"1SERVICIO DE CONSULTORÍA PARA LA ELABORACIÓN DEL EXPEDIENTE TÉCNICO DEL PROYECTO ¿CREACIÓN DEL SISTEMA DE AGUA POTABLE Y SANEAMIENTO RURAL DE CC.NN. EL PILAR, DISTRITO DE TAMBOPATA, PROVINCIA DE TAMBOPATA-REGIÓN MADRE DE DIOSSAGITARIO CONTRATISTAS GENERALES SOCIEDAD COMERCIAL DE RESPONSABILIDAD LIMITADACONTRATO N° 008-2019-MPT-GM24/05/201975,581.0075,581.00",,
2401053,306519,29/10/2014,"MEJORAMIENTO Y AMPLIACIÓN DE SEIS INSTITUCIONES EDUCATIVAS DEL NIVEL INICIAL UBICADAS EN EL DISTRITO DE TAMBOPATA, PROVINCIA DE TAMBOPATA - MADRE DE DIOS",ACTIVO,PROYECTO DE INVERSION,SI,OPMI DE LA MUNICIPALIDAD PROVINCIAL DE TAMBOPATA,UF DE LA MUNICIPALIDAD PROVINCIAL DE TAMBOPATA,UEI DE LA MUNICIPALIDAD PROVINCIAL DE TAMBOPATA,VIABLE,NO,EDUCACIÓN - EDUCACIÓN BÁSICA - EDUCACIÓN INICIAL,18/09/2015,"15,022,875.00","5,791",NO,NO,,,"15,022,875.00",0.0,0.0,"15,022,875.00","15,022,875.00","314,700.55",2.1 %,"14,708,174.45",MAR-2019,OCT-2021,,,,
2406066,2406066,29/01/2018,CREACION DEL SERVICIO DE GUA POTABLE Y SANEAMIENTO EN EL KOTSIMBA - DISTRITO DE INAMBARI - PROVINCIA DE TAMBOPATA - DEPARTAMENTO DE MADRE DE DIOS,ACTIVO,PROYECTO DE INVERSION,SI,OPMI DE LA MUNICIPALIDAD PROVINCIAL DE TAMBOPATA,UF DE LA MUNICIPALIDAD PROVINCIAL DE TAMBOPATA,UEI DE LA MUNICIPALIDAD PROVINCIAL DE TAMBOPATA,VIABLE,NO,SANEAMIENTO - SANEAMIENTO - SANEAMIENTO RURAL,23/03/2018,"1,576,645.08",150,SI,SI,24/04/2019,21/12/2023,"1,787,093.73",0.0,0.0,"1,787,093.73","1,787,093.73","1,576,512.83",88.2 %,"210,580.89",OCT-2019,DIC-2021,"1CONTRATACIÓN PARA LA EJECUCIÓN DE LA OBRA: CREACIÓN DEL SISTEMA DE AGUA POTABLE Y SANEAMIENTO EN LA COMUNIDAD NATIVA DE KOTSIMBA - DISTRITO DE INAMBARI - PROVINCIA DE TAMBOPATA - REGIÓN MADRE DE DIOSCONSORCIO KOTSIMBA29-2019-MPT-GM07/11/20191,280,537.001,280,537.00","1SERVICIO DE CONSULTORIA PARA LA ELBORACION DEL EXPEDIENTE TECNICO DEL PROYECTO ¿CREACION DEL SERVICIO DE AGUA POTABLE Y SANEAMIENTO  EN LA COMUNIDAD NATIVA DE KOTSIMBA, DISTRITO DE INAMBARI, PROVINCIA DE TAMBOPATA-MADRE  DE DIOS.ALVA INGENIEROS CONSTRUCTORES Y CONSULTORES S.A.C. - ALVA INGENIEROS S.A.C.CONTRATO N° 015-2019-MPT-GM03/06/201971,389.0071,389.00",,
2414957,2414957,30/07/2018,"MEJORAMIENTO DEL SERVICIO EDUCATIVO DE LOS NIVELES PRIMARIA Y SECUNDARIA EN LA I.E.B.R. ENAWIPA, DE LA COMUNIDAD NATIVA PALMA REAL DEL DISTRITO DE TAMBOPATA - PROVINCIA DE TAMBOPATA - DEPARTAMENTO DE MADRE DE DIOS",ACTIVO,PROYECTO DE INVERSION,NO,OPMI DEL GOBIERNO REGIONAL MADRE DE DIOS,AREA FUNCIONAL DE ESTUDIOS Y PROYECTOS - SEDE CENTRAL GOREMAD,UEI  GOBIERNO REGIONAL MADRE DE DIOS-SEDE CENTRAL,VIABLE,NO,EDUCACIÓN - EDUCACIÓN BÁSICA - EDUCACIÓN PRIMARIA,02/08/2018,"6,337,923.8",111,SI,SI,01/07/2021,30/03/2022,"15,457,273.8",0.0,0.0,"15,457,273.8","15,457,273.8","243,160.52",1.6 %,"15,214,113.28",AGO-2019,DIC-2020,,,,
2415699,2415699,23/06/2018,CREACION DE DEFENSA RIBEREÑA EN EL RIÓ APOYO DE SALVACION DEL DISTRITO DE MANU - PROVINCIA DE MANU - DEPARTAMENTO DE MADRE DE DIOS,ACTIVO,PROYECTO DE INVERSION,NO,OPMI DE LA MUNICIPALIDAD PROVINCIAL DE MANU,UF DE LA MUNICIPALIDAD PROVINCIAL DE MANU,UEI DE LA MUNICIPALIDAD PROVINCIAL DE MANU,VIABLE,NO,ORDEN PÚBLICO Y SEGURIDAD - GESTIÓN DE RIESGOS Y EMERGENCIAS - PREVENCIÓN DE DESASTRES,25/06/2018,"842,317.24","2,018",SI,SI,01/10/2019,31/01/2022,"1,385,467.01",0.0,0.0,"1,385,467.01","1,385,467.01","1,298,844.29",93.7 %,"86,622.71",SET-2019,DIC-2021,,,"1ADQUISICIÓN DE AVIONES DE TIPO CAJA PARA COLCHO Y ESTRUCTURAFREYSSINET TIERRA ARMADA PERU S.A.C. - TIERRA ARMADA S.A.C.36-2020-UA-MPM-MDD03/03/2020306,168.00306,168.00","1CONTRATACION PARA EL ALQUILER DE CAMION VOLQUETE DE 15 M3 (MAQUINA SERVIDA)CHACON PUELLES WILSON WILBERT174-2020-UA-MPM-MDD04/11/202055,050.0055,050.00"
2415704,2415704,23/06/2018,MEJORAMIENTO DE LA TRANSITABILIDAD PEATONAL EN EL SECTOR PROGRESO DE LA URBANIZACIÓN VISTA ALEGRE DE SALVACION DEL DISTRITO DE MANU - PROVINCIA DE MANU - DEPARTAMENTO DE MADRE DE DIOS,ACTIVO,PROYECTO DE INVERSION,NO,OPMI DE LA MUNICIPALIDAD PROVINCIAL DE MANU,UF DE LA MUNICIPALIDAD PROVINCIAL DE MANU,UEI DE LA MUNICIPALIDAD PROVINCIAL DE MANU,VIABLE,NO,TRANSPORTE - TRANSPORTE URBANO - VÍAS URBANAS,25/06/2018,"579,496.15","2,108",SI,SI,01/10/2019,31/01/2022,"1,359,197.9",0.0,0.0,"1,359,197.9","1,359,197.9","1,244,867.12",91.6 %,"114,330.77",JUN-2019,DIC-2021,,,"1ADQUISICION DE CEMENTO PORTLAND TIPO IP PARA LA META 015COMERCIAL B & R SOCIEDAD COMERCIAL DE RESPONSABILIDAD LIMITADA-COMERCIAL B & R S.R.L.31-201924/12/2019253,790.00253,790.00",
2416293,2416293,28/12/2018,"MEJORAMIENTO DE LA TRANSITABILIDAD VEHICULAR Y PEATONAL EN LA CALLES 11, JR. TRIUNFO, JR LOS CONQUISTADORES, JR CUSCO, PROLONGACION FRANCISCO BOLOGNESI Y PASAJE DOS DE MAYO EN LA ASOCIACION DE VIVIENDA BELLO HORIZONTE AMAZONICO EN LA  LOCALIDAD MAZUKO DEL DISTRITO DE INAMBARI - PROVINCIA DE TAMBOPATA - DEPARTAMENTO DE MADRE DE DIOS",ACTIVO,PROYECTO DE INVERSION,SI,OPMI DE LA MUNICIPALIDAD DISTRITAL DE INAMBARI,UF DE LA MUNICIPALIDAD DISTRITAL DE INAMBARI,UEI DE LA MUNICIPALIDAD DISTRITAL DE INAMBARI,VIABLE,NO,TRANSPORTE - TRANSPORTE URBANO - VÍAS URBANAS,29/12/2018,"5,582,529.98","6,700",SI,SI,01/10/2021,31/08/2022,"8,985,491.71",0.0,0.0,"8,985,491.71","8,985,491.71","35,500.00",0.4 %,"8,949,991.71",AGO-2020,SET-2020,,,,
2421619,2421619,23/04/2018,MEJORAMIENTO DE LOS SERVICIOS RECREACIONALES DE LA PARQUE CENTRAL DEL CENTRO POBLADO DE ALERTA - DISTRITO DE TAHUAMANU - PROVINCIA DE TAHUAMANU - DEPARTAMENTO DE MADRE DE DIOS,ACTIVO,PROYECTO DE INVERSION,SI,OPMI DE LA MUNICIPALIDAD DISTRITAL DE TAHUAMANU,UF DE LA MUNICIPALIDAD PROVINCIAL DE TAHUAMANU,UEI DE LA MUNICIPALIDAD PROVINCIAL DE TAHUAMANU,VIABLE,NO,AMBIENTE - GESTIÓN INTEGRAL DE LA CALIDAD AMBIENTAL - CONSERVACIÓN Y AMPLIACIÓN DE LAS ÁREAS VERDES Y ORNATO PÚBLICO,27/04/2018,"1,167,736.55","1,538",SI,SI,01/08/2019,29/07/2022,"2,070,527.05",0.0,0.0,"2,070,527.05","2,070,527.05","1,665,074.12",80.4 %,"405,452.92",JUL-2018,NOV-2021,,,"1CONTRATACION DE ADOQUIN DE CONCRETO PARA EL PROYECTO MEJORAMIENTO DE LOS SERVICIOS RECREACIONALES DEL PARQUE CENTRAL DEL C.P DE ALERTACOMERCIAL ARIANA EMPRESA INDIVIDUAL DE RESPONSABILIDAD LIMITADA00125/01/2021165,600.00165,600.001CONTRATACIÓN DE MADERA DURA 2"" X 2""x1m PARA LA META  - 0064GALLEGOS PERDOMO JANS KRENI07-2020-MP-TAH-GM-SGL28/01/2020201,302.00201,302.001CONTRATACION DE CEMENTO PORTALND IP x42.5 Kg; PARA LA META 0063GRUPO SANTA FE SOCIEDAD ANONIMA CERRADA - GRUPO SANTA FE S.A.C.02-202014/01/202072,000.0072,000.00",
2439062,2439062,05/03/2019,MEJORAMIENTO Y AMPLIACION DE LA PRESTACIÓN DEL SERVICIO DE EQUIPO MECÁNICO DE LA MUNICIPALIDAD PROVINCIAL DE TAMBOPATA PUERTO MALDONADO DEL DISTRITO DE TAMBOPATA - PROVINCIA DE TAMBOPATA - DEPARTAMENTO DE MADRE DE DIOS,ACTIVO,PROYECTO DE INVERSION,SI,OPMI DE LA MUNICIPALIDAD PROVINCIAL DE TAMBOPATA,UF DE LA MUNICIPALIDAD PROVINCIAL DE TAMBOPATA,UEI DE LA MUNICIPALIDAD PROVINCIAL DE TAMBOPATA,VIABLE,NO,"PLANEAMIENTO, GESTIÓN Y RESERVA DE CONTINGENCIA - GESTIÓN - INFRAESTRUCTURA Y EQUIPAMIENTO",20/03/2019,"14,878,540.92","122,251",NO,SI,01/08/2019,01/01/2020,"14,878,540.92",0.0,0.0,"14,878,540.92","14,878,540.92","67,096.29",0.5 %,"14,811,444.63",JUL-2019,NOV-2019,,,,
2440090,2440090,14/03/2019,MEJORAMIENTO Y AMPLIACION DEL SERVICIO DE LIMPIEZA PÚBLICA EN LA CIUDAD DE MAZUKO DEL DISTRITO DE INAMBARI - PROVINCIA DE TAMBOPATA - DEPARTAMENTO DE MADRE DE DIOS,ACTIVO,PROYECTO DE INVERSION,SI,OPMI DE LA MUNICIPALIDAD DISTRITAL DE INAMBARI,UF DE LA MUNICIPALIDAD DISTRITAL DE INAMBARI,UEI DE LA MUNICIPALIDAD DISTRITAL DE INAMBARI,VIABLE,NO,AMBIENTE - GESTIÓN INTEGRAL DE LA CALIDAD AMBIENTAL - GESTIÓN DE LOS RESIDUOS SÓLIDOS,15/03/2019,"3,302,950.16","2,029",NO,SI,01/07/2019,01/12/2019,"11,240,189.6",0.0,0.0,"11,240,189.6","11,240,189.6","71,200.00",0.6 %,"11,168,989.6",MAR-2020,JUN-2020,,"1SERVICIO DE CONSULTORIA DE OBRAS PARA LA  ELABORACION DEL EXPEDIENTE TECNICO DEL PROYECTO MEJORAMIENTO Y AMPLIACION DEL SERVICIO DE LIMPIEZA PUBLICA EN LA CIUDAD DE MAZUKO DEL DISTRITO DE INAMBARI PROVINCIA DE TAMBOPATA DEPARTAMENTO MADRE DE DIOSCONSORCIO INAMBARI011-2020-MDI/A14/01/2020178,000.00178,000.00",,
2440969,2440969,21/03/2019,"MEJORAMIENTO DE LA CAPACIDAD OPERATIVA DE LA UNIDAD DE EJECUTORA, PARA ATENCIÓN DE EMERGENCIAS E INTERVENCIONES VIALES  DISTRITO DE INAMBARI - PROVINCIA DE TAMBOPATA - DEPARTAMENTO DE MADRE DE DIOS",ACTIVO,PROYECTO DE INVERSION,SI,OPMI DE LA MUNICIPALIDAD DISTRITAL DE INAMBARI,UF DE LA MUNICIPALIDAD DISTRITAL DE INAMBARI,UEI DE LA MUNICIPALIDAD DISTRITAL DE INAMBARI,VIABLE,NO,"PLANEAMIENTO, GESTIÓN Y RESERVA DE CONTINGENCIA - RESERVA DE CONTINGENCIA - RESERVA DE CONTINGENCIA",26/03/2019,"4,879,591.88","2,025",SI,SI,20/09/2019,15/12/2022,"4,937,578.58",0.0,0.0,"4,937,578.58","4,937,578.58","3,249,116.18",65.8 %,"1,688,462.4",JUL-2019,FEB-2022,,,"1CONTRATACI¿N DE UN CARGADOR FRONTAL SOBRE RUEDAS DE 195 HP, PARA EL PROYECTO ""MEJORAMIENTO DE LA CAPACIDAD OPERATIVA DE LA UNIDAD EJECUTORA, PARA ATENCI¿N DE EMERGENCIAS E INTERVENCIONES VIALES DEL DISTRITO DE INAMBARI - PROVINCIA DE TAMBOPATA - DEPAORVISA SOCIEDAD ANONIMACONTRATO n°251-2021-MDI/GM05/08/20211,030,000.001,030,000.001ADQUISICIÓN DE MAQUINARIA PESADA: MOTO NIVELADORA ARTICULADAORVISA SOCIEDAD ANONIMACONTRATO N° 004-2019-MDA/A21/10/20191,309,000.00884,000.002ADQUISICIÓN DE MAQUINARIA PESADA: RODILLO LISO VIBRATORIO COMPACTADORORVISA SOCIEDAD ANONIMACONTRATO N° 004-2019-MDA/A21/10/20191,309,000.00425,000.003ADQUISICIÓN DE CAMIÓN VOLQUETE DE 15 m3VOLVO PERU S ACONTRATO N° 002-2019-MDA/A14/10/2019649,900.00649,900.00",
2442624,2442624,01/04/2019,MEJORAMIENTO DE LA PLAZOLETA MAZUKO DEL DISTRITO DE INAMBARI - PROVINCIA DE TAMBOPATA - DEPARTAMENTO DE MADRE DE DIOS,ACTIVO,PROYECTO DE INVERSION,NO,OPMI DE LA MUNICIPALIDAD DISTRITAL DE INAMBARI,UF DE LA MUNICIPALIDAD DISTRITAL DE INAMBARI,UEI DE LA MUNICIPALIDAD DISTRITAL DE INAMBARI,VIABLE,NO,VIVIENDA Y DESARROLLO URBANO - DESARROLLO URBANO Y RURAL - PLANEAMIENTO Y DESARROLLO URBANO Y RURAL,15/04/2019,"852,692.35","2,029",SI,SI,08/04/2019,20/09/2019,"1,257,495.69",0.0,0.0,"1,257,495.69","1,257,495.69","1,251,921.65",99.6 %,"5,574.04",SET-2019,DIC-2021,,,"1ADQUISICION DE LUMINARIAS PARA EL PROYECTO¿MEJORAMIENTO DE LA PLAZOLETA DE LA CIUDAD DE MAZUKO, DEL DISTRITO DE INAMBARI, PROVINCIA DE TAMBOPATA - DEPARTAMENTO DE MADRE DE DIOS¿INSTAELEC SRL63-2019-MDI/A09/12/2019241,400.00241,400.001CEMENTO PORTLAND PUZOLANICO TIPO IP X 42.50 kgGRUPO SANTA FE SOCIEDAD ANONIMA CERRADA - GRUPO SANTA FE S.A.C.0020523/10/201964,400.0064,400.00","1SERVICIO DE INSTALACION Y MONTAJE DE FUENTE SECA DE AGUA INTERACTIVA Y TABLERO ELECTRICO DE POTENCIA PARA EL PROYECTO MEJORAMIENTO DE LA PLAZOLETA DE LA CIUDAD DE MAZUKO  DEL DISTRITO DE INAMBARI  PROVINCIA DE TAMBOPATA   DEPARTAMENTO DE MADRE DE DIOSCOBE PERU S.R.L.687-2019-mdi/a17/12/2019372,000.00372,000.00"
2448031,2448031,17/05/2019,MEJORAMIENTO Y AMPLIACION DE LOS SERVICIOS EDUCATIVOS DEL NIVEL INICIAL DE LA I.E.I N° 334 GOTITAS DEL SABER  DE LA CIUDAD DE PUERTO MALDONADO DEL DISTRITO DE TAMBOPATA - PROVINCIA DE TAMBOPATA - DEPARTAMENTO DE MADRE DE DIOS,ACTIVO,PROYECTO DE INVERSION,NO,OPMI DEL GOBIERNO REGIONAL MADRE DE DIOS,AREA FUNCIONAL DE ESTUDIOS Y PROYECTOS - SEDE CENTRAL GOREMAD,UEI  GOBIERNO REGIONAL MADRE DE DIOS-SEDE CENTRAL,VIABLE,NO,EDUCACIÓN - EDUCACIÓN BÁSICA - EDUCACIÓN INICIAL,17/05/2019,"4,859,577.81",225,SI,SI,01/04/2021,30/10/2021,"8,120,748.18",0.0,0.0,"8,120,748.18","8,120,748.18","193,546.16",2.4 %,"7,927,202.02",SET-2019,SET-2020,,,,
2448870,2448870,24/05/2019,CREACION DE LAS CONDICIONES DE  ARTICULACIÓN Y PROMOCIÓN DE LOS EMPRENDIMIENTOS LOCALES DE LAS FAMILIAS  DISTRITO DE INAMBARI - PROVINCIA DE TAMBOPATA - DEPARTAMENTO DE MADRE DE DIOS,ACTIVO,PROYECTO DE INVERSION,NO,OPMI DE LA MUNICIPALIDAD DISTRITAL DE INAMBARI,UF DE LA MUNICIPALIDAD DISTRITAL DE INAMBARI,UEI DE LA MUNICIPALIDAD DISTRITAL DE INAMBARI,VIABLE,NO,AGROPECUARIA - AGRARIO - INOCUIDAD AGROALIMENTARIA,27/05/2019,"1,369,450.55","2,026",SI,SI,21/10/2019,30/11/2022,"474,145.71",0.0,0.0,"474,145.71","474,145.71","212,803.55",44.9 %,"261,342.16",NOV-2019,DIC-2021,,,,
2449825,2449825,01/06/2019,MEJORAMIENTO DEL CAMINO VECINAL SANTA RITA - CENTROMIN VARIANTE PONAL DEL DISTRITO DE INAMBARI - PROVINCIA DE TAMBOPATA - DEPARTAMENTO DE MADRE DE DIOS,ACTIVO,PROYECTO DE INVERSION,SI,OPMI DE LA MUNICIPALIDAD DISTRITAL DE INAMBARI,UF DE LA MUNICIPALIDAD DISTRITAL DE INAMBARI,UEI DE LA MUNICIPALIDAD DISTRITAL DE INAMBARI,VIABLE,NO,TRANSPORTE - TRANSPORTE TERRESTRE - VÍAS VECINALES,09/06/2019,"5,343,320.42",754,SI,SI,01/12/2020,30/06/2021,"11,111,744.08",0.0,0.0,"11,111,744.08","11,111,744.08","84,000.00",0.8 %,"11,027,744.08",DIC-2019,AGO-2020,,"1SERVICIO DE CONSULTORIA DE OBRAS PARA LA  ELABORACION DEL EXPEDIENTE TECNICO DEL PROYECTO MEJORAMIENTO CAMINO VECINAL SANTA RITA CENTROMIN VARIANTE PONAL DEL DISTRITO DE INAMBARI PROVINCIA DE TAMBOPATA DEPARTAMENTO MADRE DE DIOSALVAREZ FLORES RAUL ADEMIR60-2019-mdi/a02/12/2019140,000.00140,000.00",,
2450404,2450404,06/06/2019,MEJORAMIENTO Y AMPLIACION DEL SERVICIO EDUCATIVO DE LA I.E.I. N °275 SANTA ROSA DEL DISTRITO DE INAMBARI - PROVINCIA DE TAMBOPATA - DEPARTAMENTO DE MADRE DE DIOS,ACTIVO,PROYECTO DE INVERSION,SI,OPMI DE LA MUNICIPALIDAD DISTRITAL DE INAMBARI,UF DE LA MUNICIPALIDAD DISTRITAL DE INAMBARI,UEI DE LA MUNICIPALIDAD DISTRITAL DE INAMBARI,VIABLE,NO,EDUCACIÓN - EDUCACIÓN BÁSICA - EDUCACIÓN INICIAL,08/06/2019,"5,089,315.48",120,SI,SI,30/05/2022,30/08/2023,"6,111,149.54",0.0,0.0,"6,111,149.54","6,111,149.54","85,050.00",1.4 %,"6,026,099.54",JUL-2020,DIC-2020,,"1SERVICIO DE CONSULTORIA DE OBRAS PARA LA  ELABORACION DEL EXPEDIENTE TECNICO DEL PROYECTO MEJORAMIENTO Y AMPLIACION DEL SERVICIO EDUCATIVO DE LA IEI N 275 SANTA ROSA DEL DISTRITO DE INAMBARI PROVINCIA DE TAMBOPATA DEPARTAMENTO MADRE DE DIOSESTEBAN DOMINGUEZ GIAN CARLO025-2020-MDI/GM28/05/202085,050.0085,050.00",,
2450605,2450605,09/06/2019,CREACION DEL SERVICIO DE SEGURIDAD CIUDADANA BOCA COLORADO  DISTRITO DE MADRE DE DIOS - PROVINCIA DE MANU - DEPARTAMENTO DE MADRE DE DIOS,ACTIVO,PROYECTO DE INVERSION,SI,OPMI DE LA MUNICIPALIDAD DISTRITAL DE MADRE DE DIOS,UF DE LA MUNICIPALIDAD DISTRITAL DE MADRE DE DIOS,UEI DE LA MUNICIPALIDAD DISTRITAL DE MADRE DE DIOS,VIABLE,NO,ORDEN PÚBLICO Y SEGURIDAD - ORDEN INTERNO - SEGURIDAD VECINAL Y COMUNAL,12/06/2019,"3,639,965.49","1,560,100",NO,SI,01/06/2020,01/12/2020,"3,994,599.44",0.0,0.0,"3,994,599.44","3,994,599.44","219,216.35",5.5 %,"3,775,383.09",JUL-2020,NOV-2020,,,,
2450610,2450610,09/06/2019,MEJORAMIENTO DE LA AV. COLORADO DEL CENTRO POBLADO DE VILLA BOCA COLORADO DEL DISTRITO DE MADRE DE DIOS - PROVINCIA DE MANU - DEPARTAMENTO DE MADRE DE DIOS,ACTIVO,PROYECTO DE INVERSION,SI,OPMI DE LA MUNICIPALIDAD DISTRITAL DE MADRE DE DIOS,UF DE LA MUNICIPALIDAD DISTRITAL DE MADRE DE DIOS,UEI DE LA MUNICIPALIDAD DISTRITAL DE MADRE DE DIOS,VIABLE,NO,TRANSPORTE - TRANSPORTE URBANO - VÍAS URBANAS,12/06/2019,"7,090,222.59",610,SI,SI,01/06/2021,31/12/2024,"7,101,755.7",0.0,0.0,"7,101,755.7","7,101,755.7","211,820.72",3 %,"6,889,934.98",JUL-2020,NOV-2021,,,,
2450612,2450612,09/06/2019,MEJORAMIENTO Y AMPLIACION DE LA I. E. PRIMARIA N°52129 PUERTO MAZUKO DEL DISTRITO DE INAMBARI - PROVINCIA DE TAMBOPATA - DEPARTAMENTO DE MADRE DE DIOS,ACTIVO,PROYECTO DE INVERSION,SI,OPMI DE LA MUNICIPALIDAD DISTRITAL DE INAMBARI,UF DE LA MUNICIPALIDAD DISTRITAL DE INAMBARI,UEI DE LA MUNICIPALIDAD DISTRITAL DE INAMBARI,VIABLE,NO,EDUCACIÓN - EDUCACIÓN BÁSICA - EDUCACIÓN PRIMARIA,09/06/2019,"6,610,936.95","2,029",SI,SI,05/05/2022,30/03/2023,"6,215,519.78",0.0,0.0,"6,215,519.78","6,215,519.78","97,600.00",1.6 %,"6,117,919.78",DIC-2019,DIC-2019,,"1SERVICIO DE CONSULTORIA DE OBRAS PARA LA  ELABORACION DEL EXPEDIENTE TECNICO DEL PROYECTO MEJORAMIENTO Y AMPLIACION DE LA IE  PRIMARIA N 52129 PUERTO MAZUKO DEL DISTRITO DE INAMBARI PROVINCIA DE TAMBOPATA DEPARTAMENTO MADRE DE DIOSCONSORCIO EDUCATIVO PUERTO MAZUKO61-2019-MDI/A03/12/2019122,000.00122,000.00",,
2450639,2450639,10/06/2019,MEJORAMIENTO Y AMPLIACION I. E. PRIMARIA  N°52077 PALMERA DEL DISTRITO DE INAMBARI - PROVINCIA DE TAMBOPATA - DEPARTAMENTO DE MADRE DE DIOS,ACTIVO,PROYECTO DE INVERSION,SI,OPMI DE LA MUNICIPALIDAD DISTRITAL DE INAMBARI,UF DE LA MUNICIPALIDAD DISTRITAL DE INAMBARI,UEI DE LA MUNICIPALIDAD DISTRITAL DE INAMBARI,VIABLE,NO,EDUCACIÓN - EDUCACIÓN BÁSICA - EDUCACIÓN PRIMARIA,13/06/2019,"7,046,187.53",72,SI,SI,01/10/2020,30/06/2021,"7,231,957.47",0.0,0.0,"7,231,957.47","7,231,957.47","95,920.00",1.3 %,"7,136,037.47",JUL-2020,DIC-2020,,"1SERVICIO DE CONSULTORIA DE OBRAS PARA LA  ELABORACION DEL EXPEDIENTE TECNICO DEL PROYECTO MEJORAMIENTO Y AMPLIACION IE  PRIMARIA N 52077 PALMERAS DEL DISTRITO DE INAMBARI PROVINCIA DE TAMBOPATA DEPARTAMENTO MADRE DE DIOSESTEBAN DOMINGUEZ GIAN CARLO024-2020-MDI/GM28/05/2020119,900.00119,900.00",,
2450723,2450723,10/06/2019,MEJORAMIENTO Y AMPLIACION DE LOS SERVICIOS DE SANEAMIENTO BÁSICO INTEGRAL EN LA CC.NN. SAN JOSE DE KARENE DEL DISTRITO DE MADRE DE DIOS - PROVINCIA DE MANU - DEPARTAMENTO DE MADRE DE DIOS,ACTIVO,PROYECTO DE INVERSION,SI,OPMI DE LA MUNICIPALIDAD DISTRITAL DE MADRE DE DIOS,UF DE LA MUNICIPALIDAD DISTRITAL DE MADRE DE DIOS,UEI DE LA MUNICIPALIDAD DISTRITAL DE MADRE DE DIOS,VIABLE,NO,SANEAMIENTO - SANEAMIENTO - SANEAMIENTO RURAL,12/06/2019,"2,509,341.00",430,SI,SI,02/05/2022,31/12/2024,"2,558,818.67",0.0,0.0,"2,558,818.67","2,558,818.67","86,850.00",3.4 %,"2,471,968.67",AGO-2020,NOV-2021,,"1ELABORACION DE EXPEDIENTE TECNICO PARA EL MEJORAMIENTO DEL SERVICIO DE AGUA POTABLE DEL DIST. DE MADRE DE DIOS.CONSORCIO HORIZONTE11-2020-MDMDD-GM06/07/2020108,000.00108,000.00",,
2454485,2454485,12/07/2019,"MEJORAMIENTO DE LA TRANSITABILIDAD PEATONAL DE LOS JIRONES ISHIRIWE, SETAPO, PUERTO LUZ, SAN JOSE DE KARENE, PUQUIRI, COLONIAL, GUACAMAYO, CAIMITO, DOS , TRES , CUATRO , CINCO , SEIS ,SOL , ITALIA , INKAS , LUIS RIVEROS Y LAS AVENIDAS FITZCARRALD Y MANU DEL CENTRO POBLADO VILLA BOCA COLORADO DEL DISTRITO DE MADRE DE DIOS - PROVINCIA DE MANU - DEPARTAMENTO DE MADRE DE DIOS",ACTIVO,PROYECTO DE INVERSION,SI,OPMI DE LA MUNICIPALIDAD DISTRITAL DE MADRE DE DIOS,UF DE LA MUNICIPALIDAD DISTRITAL DE MADRE DE DIOS,UEI DE LA MUNICIPALIDAD DISTRITAL DE MADRE DE DIOS,VIABLE,NO,TRANSPORTE - TRANSPORTE URBANO - VÍAS URBANAS,19/07/2019,"1,143,998.56",10,SI,SI,01/10/2019,30/12/2022,"1,180,998.69",0.0,0.0,"1,180,998.69","1,180,998.69","1,169,244.09",99 %,"11,754.59",SET-2019,NOV-2021,,,"1CEMENTO PORTLAND TIPO I X 42.50 kgGRUPO AMAZON TARGONTEC S.R.L.005-2020-MDMDD-GM11/02/2020315,439.00315,439.00",
2455532,2455532,22/07/2019,CREACION DE DEFENSA RIBEREÑA EN LA QUEBRADA LORO AURORA DE LA LOCALIDAD DE MAZUKO DEL DISTRITO DE INAMBARI - PROVINCIA DE TAMBOPATA - DEPARTAMENTO DE MADRE DE DIOS,ACTIVO,PROYECTO DE INVERSION,SI,OPMI DE LA MUNICIPALIDAD DISTRITAL DE INAMBARI,UF DE LA MUNICIPALIDAD DISTRITAL DE INAMBARI,UEI DE LA MUNICIPALIDAD DISTRITAL DE INAMBARI,VIABLE,NO,ORDEN PÚBLICO Y SEGURIDAD - GESTIÓN DE RIESGOS Y EMERGENCIAS - PREVENCIÓN DE DESASTRES,23/07/2019,"1,127,474.54","1,116",SI,SI,01/10/2019,31/01/2020,"1,249,540.48",0.0,0.0,"1,249,540.48","1,249,540.48","1,136,299.8",90.9 %,"113,240.67",DIC-2019,DIC-2021,,,"1CONTRATACION DE GAVIONES DE DIFERENTES MEDIDAS, OBRA QUEBRADA LORO AURORAA & C CONSULTORES Y MULTISERVICIOS S.A.C.RESOLUCION DE ALCALDIA 143-2020-MDI/T05/08/2020301,000.00301,000.00",
2455701,2455701,23/07/2019,"CREACION DE ADECUADAS CONDICIONES PARA EL DESARROLLO DE ACTIVIDADES DE RECREACIÓN PASIVA,CÍVICA Y CULTURAL EN LA PLAZA PRINCIPAL DE LA LOCALIDAD DE MAZUKO DEL DISTRITO DE INAMBARI - PROVINCIA DE TAMBOPATA - DEPARTAMENTO DE MADRE DE DIOS",ACTIVO,PROYECTO DE INVERSION,SI,OPMI DE LA MUNICIPALIDAD DISTRITAL DE INAMBARI,UF DE LA MUNICIPALIDAD DISTRITAL DE INAMBARI,UEI DE LA MUNICIPALIDAD DISTRITAL DE INAMBARI,VIABLE,NO,VIVIENDA Y DESARROLLO URBANO - DESARROLLO URBANO Y RURAL - PLANEAMIENTO Y DESARROLLO URBANO Y RURAL,24/07/2019,"863,541.54","12,816",SI,SI,01/10/2019,31/01/2020,"1,419,546.07",0.0,0.0,"1,419,546.07","1,419,546.07","1,307,249.9",92.1 %,"112,296.17",NOV-2019,DIC-2021,,,"1CONTRATACIÓN DE ESTRUCTURAS DE MADERA Y ACERO (PÉRGOLAS) INCLUIDO INSTALACIÓN Y ACABADOS A TODO COSTO SEGÚN DISEÑO PARA LA EJECUCIÓN DEL PROYECTO: ""CREACIÓN DE ADECUADAS CONDICIONES PARA EL DESARROLLO DE ACTIVIDADES DE RECREACIÓN PASIVA, CÍVICA Y CULTURAL EN LA PLAZA PRINCIPAL DE LA LOCALIDAD DE MAZUKO DEL DISTRITO DE INAMBARI - PROVINCIA DE TAMBOPATA - DEPARTAMENTO DE MADRE DE DIOS"" CÓDIGO ÚNICO DE INVERSIONES 2455701LUIZAR ASTETE ELVIS011-2021-MDI/GM21/01/202172,000.0072,000.001ADQUISICION DE ADOQUIN DE CONCRETO DE 0.10X0.20X0.06 M OBRA-PLAZA PRINCIPALGRUPO SANTA FE SOCIEDAD ANONIMA CERRADA - GRUPO SANTA FE S.A.C.020-2020-MDI/GM09/03/2020118,900.00118,900.001ADQUISICIÓN DE CEMENTO PORTLAND PUZOLANICO TIPO IP X 42.50 KG. OBRA-PLAZA PRINCIPALGRUPO SANTA FE SOCIEDAD ANONIMA CERRADA - GRUPO SANTA FE S.A.C.017-2020-MDI/GM18/02/2020160,599.00160,599.00","1CONTRATACIÓN DE ALQUILER DE CAMIÓN VOLQUETE PARA LA META 0032: ""CREACIÓN DE ADECUADAS CONDICIONES PARA EL DESARROLLO DE ACTIVIDADES DE RECREACIÓN PASIVA, CÍVICA Y CULTURAL EN LA PLAZA PRINCIPAL DE LA LOCALIDAD DE MAZUKO DEL DISTRITO DE INAMBARI-TAMBOINVER GOLD S.R.L.26-202011/06/202043,962.0043,962.00"
