codigo_unico,snip,fecha_registro,nombre_inversion,estado,tipo_inversion,programa_pmi,ompi,uf,uei,situacion,decreto_emergencia,cadena_funcional,viabilidad_aprobacion,costo_aprobado,beneficiarios,expediente_tecnico,reg_seguimiento,inicio_ejecucion,fin_ejecucion,inversion_actualizado,sol_controversias,carta_fianza,inver_total,costo_inversion,devengado_acumulado,avance_financiero_acum,saldo,fecha_primerdevengado,fecha_ultimodevengado,seaceobra,seaceconsul,seacebien,seaceserv
2234315,260733,18/05/2013,"MEJORAMIENTO DE LA PRESTACIÓN DE SERVICIOS PÚBLICOS DE LA DIRECCIÓN DE SANEAMIENTO FÍSICO LEGAL DE LA PROPIEDAD RURAL - DIRECCION REGIONAL DE AGRICULTURA , PROVINCIA DE TAMBOPATA, REGION MADRE DE DIOS",ACTIVO,PROYECTO DE INVERSION,NO,OPMI DEL GOBIERNO REGIONAL MADRE DE DIOS,UF DIRECCIÓN REGIONAL DE AGRICULTURA,UEI DIRECCION REGIONAL DE AGRICULTURA,VIABLE,NO,AGROPECUARIA - AGRARIO - INOCUIDAD AGROALIMENTARIA,31/01/2014,"9,341,630.00","4,650",SI,SI,19/08/2015,30/12/2021,"10,486,744.68",0.00,0.00,"10,486,744.68","10,486,744.68","10,390,444.51",99.1 %,"96,300.16",AGO-2014,DIC-2021,,,"1ADQUISICION DE 01 EQUIPO GPS DIFERENCIAL PARA EL PROYECTO: MEJORAMIENTO DE LA PRESTACIÓN DE SERVICIOS PÚBLICOS DE LA DIRECCIÓN DE SANEAMIENTO FÍSICO LEGAL DE LA PROPIEDAD RURAL-DRA-GOREMAD, PROVINCIA DE TAMBOPATA, REGIÓN DE MADRE DE DIOS.ISETEK S A00014430/12/201932,900.0032,900.001ADQUISICION DE 01 ESTACION GPS BASE DE OPERACION CONTINUA GPS CORS PARA EL PROYECTO: MEJORAMIENTO DE LA PRESTACIÓN DE SERVICIOS PÚBLICOS DE LA DIRECCIÓN DE SANEAMIENTO FÍSICO LEGAL DE LA PROPIEDAD RURAL-DRA-GOREMAD, PROVINCIA DE TAMBOPATA, REGIÓN DE MADRE DE DIOS.GEO SYSTEMS S.A.C.00014530/12/201963,661.0063,661.001ADQUISICION DE 04 MOTOCICLETAS, PARA EL PROYECTO: MEJORAMIENTO DE LA PRESTACIÓN DE SERVICIOS PÚBLICOS DE LA DIRECCIÓN DE SANEAMIENTO FÍSICO LEGAL DE LA PROPIEDAD RURAL-DRA-GOREMAD, PROVINCIA DE TAMBOPATA, REGIÓN DE MADRE DE DIOS.CORPORACION L & A MAYORGA EMPRESA INDIVIDUAL DE RESPONSABILIDAD LIMITADA00012004/12/201939,600.0039,600.001ADQUISICION DE CEMENTO PORTLAND TIPO IP (42.5KG), PARA EL PROYECTO: MEJORAMIENTO DE LA PRESTACIÓN DE SERVICIOS PÚBLICOS DE LA DIRECCIÓN DE SANEAMIENTO FÍSICO LEGAL DE LA PROPIEDAD RURAL-DRA-GOREMAD, PROVINCIA DE TAMBOPATA, REGIÓN DE MADRE DE DIOS.ZAMORA CORPORATION S.R.L.11603/12/201973,077.0073,077.001EQUIPOS GPS DIFERENCIAL SUBMETRICOISETEK S A005-2017-GRMDD-GRDE/DRA/AS12/12/2017255,760.00198,000.002EQUIPO GPS ROVER GEODESICOISETEK S A005-2017-GRMDD-GRDE/DRA/AS12/12/2017255,760.0057,760.001ADQUISICION DE MOTOCICLETAS LINEALESINVERSIONES GENERALES LA MARINA S.R.L.004-2017-GRMDD-GRDE/DRA/AS25/07/201772,850.0072,850.001ADQUISICION DE UNA CAMIONETA DOBLE CABINA 4 X 4CONCESIONES GENERALES PERU AUTOMOTRIZ S.A.C.003-2017-GRMDD-GRDE/DRA/AS05/07/2017166,959.00166,959.001EQUIPOS GPS DIFERENCIALISETEK S A002-2017-GRMDD-GRDE/DRA/AS10/05/2017155,500.00155,500.001GPS DIFERENCIAL SUBMETRICOISETEK S A006-2015-GRMDD-GRDE/DRA-OA-ADS23/12/201552,540.0052,540.001GPS DIFERENCIAL SUBMETRICOISETEK S A005-2015-GRMDD-GRDE/DRA-OA-ADS30/11/2015103,200.00103,200.00","1CONTRATACI¿N DEL SERVICIO DE INSTALACI¿N Y MONTAJE DE RED PRIMARIA Y SUB ESTACI¿N DE DISTRIBUCI¿N A TODO COSTO PARA EL PROYECTO ""MEJORAMIENTO DE LA PRESTACI¿N DE SERVICIOS PUBLICOS DE LA DIRECCI¿N DE SANEAMIENTO F¿SICO LEGAL DE LA PROPIEDAD RURAL  - DIRECCI¿N REGIONAL DE AGRICULTURA DE MADRE DE DIOS, PROVINCIA DE TAMBOPATA, REGION MADRE DE DIOS"".SAV CONSULTORIA Y OBRAS EN GENERAL SOCIEDAD COMERCIAL DE RESPONSABILIDAD LIMITADAN° 007-2021-GOREMAD-GRDE/DRA18/10/2021140,000.00140,000.001SERVICIO DE ELABORACIÓN E INSTALACIÓN DE MURO CORTINA A TODO COSTO.TORRES ORCON DANIEL ALANCONTRATO N°001-2021-GOREMAD-GRDE/DRA12/04/202193,340.0093,340.00"
2234397,74282,22/01/2008,MEJORAMIENTO DE LA OFERTA DE LOS SERVICIOS EDUCATIVOS EN LA IEBR FAUSTINO MALDONADO DE LA CIUDAD DE PUERTO MALDONADO - REGION MADRE DE DIOS,ACTIVO,PROYECTO DE INVERSION,NO,OPMI DEL GOBIERNO REGIONAL MADRE DE DIOS,AREA FUNCIONAL DE ESTUDIOS Y PROYECTOS - SEDE CENTRAL GOREMAD,UEI  GOBIERNO REGIONAL MADRE DE DIOS-SEDE CENTRAL,VIABLE,NO,EDUCACION Y CULTURA - INFRAESTRUCTURA EDUCATIVA - EDIFICACIONES ESCOLARES,17/10/2013,"14,909,856.00","18,150",SI,SI,22/05/2017,28/05/2022,"21,252,483.13",0.00,0.00,"21,252,483.13","21,252,483.13","21,086,700.32",99.2 %,"165,782.80",DIC-2014,DIC-2019,,,"1CEMENTO PORTLAND PUZOLANICO TIPO IP X 42.50 kgCODECO E.I.R.L31602/04/201961,828.0061,828.001CEMENTO PORTLAND PUZOLANICO TIPO IP X 42.50 kgZAMORA CORPORATION S.R.L.236821/11/201882,017.0082,017.001ADQUISICION DE PINTURAS ,OBRA: ¿ MEJORAMIENTO DE LA OFERTA  DE LOS SERViCIOS EDUCATIVOS EN LA IEBR FAUSTINO MALDONADO DE LA CUIDAD DE PUERTO MALDONADO-REGION MADRE DE DIOS¿. META : 21INVERSIONES JUMAZA S.A.C.203315/10/201870,380.0070,380.001ADQUISICION DE CEMENTO PORTAND PUZOLANICO TIPO IP X 42.50 KG, OBRA. ""MEJORAMIENTO  DE LA OFERTA DE LOS SERVICIOS EDUCATIVOS EN LA IEBR FAUSTINO MALDONADO DE LA CIUDAD DE PUERTO MALDONADO - REGION MADRE DE DIOS""FERRETERIA JHON EMPRESA INDIVIDUAL DE RESPONSABILIDAD LIMITADA - FERRETERIA JHON E.I.R.L.165828/08/201876,429.0076,429.001ADQUISICION DE POLIESTIRENO EXPANDIDO 15 CM X 30CM X 3.00M., OBRA: ""MEJORAMIENTO DE LA OFERTA DE LOS SERVICIOS EDUCATIVOS EN LA IEBR FAUSTINO MALDONADO DE LA CIUDAD DE PUERTO MALDONADO - REGION MADRE DE DIOS"", META 21COMERCIAL ARIANA EMPRESA INDIVIDUAL DE RESPONSABILIDAD LIMITADA86115/05/201841,866.0041,866.001ADQUISICION DE MOBILIARIO ESCOLAR, OBRA: ""MEJORAMIENTO DE LA OFERTA DE LOS SERVICIOS EDUCATIVOS EN LA IEBR FAUSTINO MALDONADO DE LA CIUDAD DE PUERTO MALDONADO - REGION MADRE DE DIOS"", META 21INDUSTRIA MADERERA LIMSOLL SEÑOR DE AYLANA E.I.R.L.37-2018-GOREMAD/GGR14/06/2018533,005.00533,005.001ADQUISICION DE CERAMICOS Y PEGAMENTOS PARA CERAMICO PARA LA OBRA MEJORAMIENTO DE LA OFERTA DE LOS SERVICIOS EDUCATIVOS EN LA I.E.B.R. FAUSTINO MALDONADO DE LA CIUDAD DE PUERTO MALDONADO REGION MADRE DE DIOS.CONSORCIO023-2018-GOREMAD/GGR16/05/2018154,935.00154,935.001ADQUISICION DE PINTURA Y OTROS INSUMOS PARA TRABAJOS DE PINTADO INTERIOR Y EXTERIOR., OBRA: ""MEJORAMIENTO DE LA OFERTA DE LOS SERVICIOS EDUCATIVOS EN LA IEBR FAUSTINO MALDONADO DE LA CIUDAD DE PUERTO MALDONADO - REGION MADRE DE DIOS"", META 21VELA HERRERA LUPE63213/04/201895,519.0095,519.001VENTILADOR ELECTRICO PARA TECHO DE 5 VELOCIDADESCORPORACION YNEM EMPRESA  INDIVIDUAL DE RESPONSABILIDAD LIMITADA- CORP. YNEM E.I.R.L.123911/07/201852,295.0052,295.001VENTILADOR ELECTRICO PARA TECHO DE 5 VELOCIDADESTRUCK PROFESSIONAL BUSINESS S.A.C.676-201819/04/20180.000.001ADQUISICION DE LADRILLO MECANIZADO DE 18 HUECOS 9 X 13 X 24 CM. PARA LA OBRA  MEJORAMIENTO DE LA OFERTA DE LOS SERVICIOS EDUCATIVOS EN LA I.E.B.R. FAUSTINO MALDONADO DE LA CIUDAD DE PUERTO MALDONADO REGION MADRE DE DIOS PROVINCIA MANUCOMERCIALIZADORA EL YUYO EMPRESA INDIVIDUAL DE RESPONSABILIDAD LIMITADA05-2018-GOREMAD-GGR19/03/201898,930.0098,930.001ADQUISICIÓN  DE VARILLA DE ACERO CORRUGADO FY= 4200 KG/CM2 GRADO 60 PARA LA OBRA: MEJORAMIENTO DE LA OFERTA DE LOS SERVICIOS EDUCATIVOS EN LA IEBR FAUSTINO MALDONADO DE LA CIUDAD DE PUERTO MALDONADO - REGION MADRE DE DIOS.  META-21CODECO E.I.R.L07-2018-GOREMAD/GGR19/03/2018637,097.00637,097.001ADQUISICION DE CEMENTO PORTLAND TIPO IP (42.50 KG) PARA LA OBRA  MEJORAMIENTO DE LA OFERTA DE LOS SERVICIOS EDUCATIVOS EN LA I.E.B.R. FAUSTINO MALDONADO DE LA CIUDAD DE PUERTO MALDONADO REGION MADRE DE DIOS PROVINCIA MANUFERRETERIA INTEROCEANICA EMPRESA INDIVIDUAL DE RESPONSABILIDAD LIMITADA  - FERRETERIA INTEROCEANICA08-2018-GOREMAD/GGR20/03/2018361,088.00361,088.001ADQUISICION DE TRIPLAY PAR LA OBRA MEJORAMIENTO DE LA OFERTA DE LOS SERVICIOS EDUCATIVOS EN LA IEBR FAUSTINO MALDONADO DE LA CIUDAD DE PUERTO MALDONADOTECHOS MULTIFORMAS E.I.R.L.1407-201725/08/201761,700.0061,700.001ADQUISICION  DE MADERAMEN PARA LA OBRA  MEJORAMIENTO DE LA OFERTA DE LOS SERVICIOS EDUCATIVOS EN LA IEBR FAUSTINO MALDONADO DE LA CIUDAD DE PUERTO MALDONADOCOSORCIO INVERSIONES CORPORATIVA JODAV EIRL Y INVERSIONES DJ EL CARIBE SAC.037-2017-GOREMAD/GGR08/09/2017189,482.00189,482.001ADQUISICION DE MATERIAL AGREGADO  PARA LA  OBRA MEJORAMIENTO DE LA OFERTA DE LOS SERVICIOS EDUCATIVOS EN LA IEBR FAUSTINO MALDONADO DE LA CIUDAD DE PUERTO MALDONADOK.T. CONTRATISTAS GENERALES S.R.L.036-201731/08/2017183,900.00183,900.001BARRA PARA CONSTRUCCION DE 3/8 in GRADO 60COMERCIALIZADORA GRUPO SANTA FE SOCIEDAD ANONIMA CERRADA - COMERCIALIZADORA GRUPO SANTA FE S.A.C.033-201723/08/2017641,300.00641,300.001ADQUISICION DE CEMENTO PORTLAND TIPO IP X 42.50 KG. PARA LA OBRA MEJORAMIENTO DE LA OFERTA DE LOS SERVICIOS EDUCATIVOS EN LA IEBR FAUSTINO MALDONADO DE LA CIUDAD DE PUERTO MALDONADOGRUPO SANTA FE SOCIEDAD ANONIMA CERRADA - GRUPO SANTA FE S.A.C.03018/08/2017582,862.00582,862.00","1SERVICIO DE SUMINISTRO, CONFECCION Y MONTAJE A TODO COSTO DE 01 TECHO METALICO PARABOLICO - NIVEL SECUNDARIA, OBRA: ""MEJORAMIENTO DE LA OFERTA DE LOS SERVICIOS EDUCATIVOS EN LA IEBR FAUSTINO MALDONADO DE LA CIUDAD DE PUERTO MALDONADO - REGION MADRE DSIN FRONTERAS CONSULTORES & EJECUTORES S.A.C.68-2018-GOREMAD/GGR21/09/2018185,000.00185,000.001SERVICIO DE SUMINISTRO, INSTALACION Y PUESTA EN FUNCIONAMIENTO A TODO COSTO DE LA SUBESTACION DE DISTRIBUCION 125KVA 10-22. 9/0.22 KV., OBRA: ""MEJORAMIENTO DE LA OFERTA DE LOS SERVICIOS EDUCATIVOS EN LA IEBR FAUSTINO MALDONADO DE LA CIUDAD DE PUERTOINGENIERIA NEGOCIOS Y SERVICIOS MULTIPLES ALPHO EMPRESA INDIVIDUAL DE RESPONSABILIDAD LIMITADA51-2018-GOREMAD/GGR21/08/201894,500.0094,500.001SERVICIO DE SUMINISTRO, CONFECCION Y MONTAJE A TODO COSTO DE 01 TECHO METALICO PARABOLICO - NIVEL PRIMARIA, OBRA: ""MEJORAMIENTO DE LA OFERTA DE LOS SERVICIOS EDUCATIVOS EN LA IEBR FAUSTINO MALDONADO DE LA CIUDAD DE PUERTO MALDONADO - REGION MADRE DECONSORCIO MADRE DE DIOS043-2018-GOREMAD/GGR09/07/2018135,000.00135,000.001SERVICIO DE PREPARACION Y COLOCACION DE CONCRETO PREMEZCLADO F`C =175 KG/CM2 Y F`C= 210 KG/CM2, OBRA ""MEJORAMIENTO DE LA OFERTA DE LOS SERVICIOS EDUCATIVOS EN LA IEBR FAUSTINO MALDONADO DE LA CIUDAD DE PUERTO MALDONADO - REGION MADRE DE DIOS"", META 2IMPORTACION RENTA DE MAQUINARIAS DE CONSTRUCCION SOCIEDAD ANÓNIMA CERRADA - IMAQ S.A.C.40-2018-GOREMAD/GGR18/06/2018390,635.00390,635.001SERVICIO DE SUMINISTRO , FABRICACION E INSTALACION DE BARANDAS METALICAS EN ESCALERAS, PASADIDOS DEL NIVEL PRIMARIO  Y SECUNDARIO  Y EN LAS GRADERIAS DE LOS POLIDEPORTIVOS, OBRA: ""MEJORAMIENTO DE LA OFERTA DE LOS SERVICIOS EDUCATIVOS EN LA IEBR FAUSTCUSIHUALLPA CCOACCALLE RICHARD022-2018-GOREMAD/GGR16/05/201877,500.0077,500.001SERVICIO DE SUMINISTRO , FABRICACION E INSTALACION DE REJAS METALICAS EN CERCO PERIMETRICO, OBRA: ""MEJORAMIENTO DE LA OFERTA DE LOS SERVICIOS EDUCATIVOS EN LA IEBR FAUSTINO MALDONADO DE LA CIUDAD DE PUERTO MALDONADO - REGION MADRE DE DIOS"", META 21CUSIHUALLPA CCOACCALLE RICHARD027-2018-GOREMAD/GGR22/05/2018105,000.00105,000.001SERVICIO DE SUMINISTRO E  INSTALACION DE PUERTAS DE MADERA, OBRA: ""MEJORAMIENTO DE LA OFERTA DE LOS SERVICIOS EDUCATIVOS EN LA IEBR FAUSTINO MALDONADO DE LA CIUDAD DE PUERTO MALDONADO - REGION MADRE DE DIOS"", META 21PACCO MONTESINOS DOMINGO021-2018-GOREMAD/GGR15/05/2018169,900.00169,900.001SERVICIO DE SUMINISTRO, FABRICACION E INSTALACION DE VENTANAS DE VIDRIO CRUDO DE 6MM CON ALUMINIO Y LAMINA DE SEGURIDAD PARA LA OBRA  MEJORAMIENTO DE LA OFERTA DE LOS SERVICIOS EDUCATIVOS EN LA I.E.B.R. FAUSTINO MALDONADO DE LA CIUDAD DE PUERTO MALDOMONDRAGON TORRES MARIA SOLEDAD33-2018-GOREMAD/GGR04/06/2018255,000.00255,000.00"
2234401,96128,02/09/2008,"MEJORAMIENTO DE LA OFERTA DE SERVICIOS EDUCATIVOS DE LA I.E. SIMON BOLIVAR DE LA LOCALIDAD DE MAZUCO, DISTRITO DE INAMBARI, PROVINCIA DE TAMBOPATA - REGION MADRE DE DIOS",ACTIVO,PROYECTO DE INVERSION,NO,OPMI DEL GOBIERNO REGIONAL MADRE DE DIOS,AREA FUNCIONAL DE ESTUDIOS Y PROYECTOS - SEDE CENTRAL GOREMAD,UEI  GOBIERNO REGIONAL MADRE DE DIOS-SEDE CENTRAL,VIABLE,NO,EDUCACION Y CULTURA - INFRAESTRUCTURA EDUCATIVA - EDIFICACIONES ESCOLARES,09/07/2013,"14,957,914.00","17,536",SI,SI,01/09/2015,11/03/2018,"20,985,542.14",0.00,0.00,"20,985,542.14","20,985,542.14","20,655,228.44",98.4 %,"330,313.69",MAR-2014,JUN-2019,,"1CONTRATACIÓN DEL SERVICIO DE CONSULTORÍA DE OBRA PARA LA ELABORACION DE EXPEDIENTE TECNICO DEL PROYECTO ¿AMPLIACION Y MEJORAMIENTO DE LOS SERVICIOS DE AGUA POTABLE Y ALCANTARILLADO SANITARIO DE LA LOCALIDAD DE MAZUKO DEL DISTRITO DE INAMBARI - PROVINCHINCHAY BARRAGAN VICTOR MARTIN8231/12/2019410,707.00410,707.00","1ADQUISICIÓN DE CEMENTO PORTLAND TIPO IP PARA LA OBRA MEJORAMIENTO DE LA OFERTA DE SERVICIOS EDUCATIVOS DE LA INSTITUCIÓN EDUCATIVA SIMON BOLIVAR DE LA LOCALIDAD DE MAZUÑO, DISTRITO DE INAMBARI, PROVINCIA DE TAMBOPATA, REGIÓN MADRE DE DIOSZAMORA CORPORATION S.R.L.171929/09/201766,083.0066,083.001ADQUISICION DE CERAMICO DE DIFERENTES MEDIDAS  OBRA: MEJ DE LA OFERTA DE LOS SERVICIOS EDUCATIVOS DE LA I.E. SIMON BOLIVAR DE LA LOCALIDAD DE MAZUCO, INAMBARI, TAMBOPATA, REGIàN MDD, META:0015GRUPO SANTA FE SOCIEDAD ANONIMA CERRADA - GRUPO SANTA FE S.A.C.157423/11/201667,270.0067,270.001ADQUISICION DE PINTURAS PARA OBRA: MEJ DE LA OFERTA DE LOS SERVICIOS EDUCATIVOS DE LA I.E. SIMON BOLIVAR DE LA LOCALIDAD DE MAZUCO,  INAMBARI,  TAMBOPATA, REGIàN MDD, META:0015VELA CASTRO MANUEL IVAN157323/11/201643,488.0043,488.001ADQUISICION DE MOBILIARIO ESCOLAR DE MADERA TORNILLO OBRA: MEJ DE LA OFERTA DE LOS SERVICIOS EDUCATIVOS DE LA I.E. SIMON BOLIVAR DE LA LOCALIDAD DE MAZUCO, INAMBARI, TAMBOPATA, REGIàN MDD. META:015MUEBLES Y DECORACIONES URPI S.A.C.040-2016-GOREMAD-GGR15/12/2016317,837.00317,837.001ADQUISICIàN DE PINTURA OBRA: MEJORAMIENTO Y AMPLIACIàN DE LA OFERTA DE LOS SERVICIOS EDUCATIVOS DE LA I.E. AUGUSTO BOURONCLE ACU¥A, PUERTO MADONADOCHATATA CASTELO ENMA111518/08/201677,665.0077,665.001ADQUISICION DE TABLAS Y LISTONES DE MADERACALVO TRIGOSO JHELEN LARISA51419/04/201639,000.0039,000.001ADQ DE ARTEFACTO MDLO RES STD RAC 2TL 36 EE  OBRA: MEJ DE LA OFERTA DE LOS SERVICIOS EDUCATIVOS DE LA I.E. SIMON BOLIVAR DE LA LOCALIDAD DE MAZUCO,  INAMBARI ,TAMBOPATA, REGIàN MDDKMT RODRIGUEZ E.I.R.L.59309/05/201658,030.0058,030.001ADQ DE CABLE DE DIFERENTES MEDIDAS OBRA: MEJ DE LA OFERTA DE LOS SERVICIOS EDUCATIVOS DE LA I.E. SIMON BOLIVAR DE LA LOCALIDAD DE MAZUCO, INAMBARI, TAMBOPATA, REGIàN MDDINDUSTRIAS ARTURO CRUZ S.R.L. - INDUSAC S.R.L.016-2016/GOREMAD/GGR13/05/2016129,121.00129,121.001ADQ DE BLOQUE HUECO DE ARCILLA DE 15 X 20 X 30 OBRA: MEJ DE LA OFERTA DE LOS SERVICIOS EDUCATIVOS DE LA I.E. SIMON BOLIVAR DE LA LOCALIDAD DE MAZUCO, INAMBARI, TAMBOPATA, REGIàN MDDLADRILLERA DEL SUR S.R.L.57403/05/201688,800.0088,800.001CEMENTO PORTLAND PUZOLANICO TIPO IP X 42.50 kgFERRETERIA JHON EMPRESA INDIVIDUAL DE RESPONSABILIDAD LIMITADA - FERRETERIA JHON E.I.R.L.13-2016-GOREMAD/GGR20/04/2016572,700.00572,700.001BARRA PARA CONSTRUCCION DE 3/8 in GRADO 60L & P INGROUP S.A.C.46213/04/201636,000.0036,000.002BARRA PARA CONSTRUCCION DE 1/2 in GRADO 60DISTRIBUCION Y CONSTRUCCION SELVA S.A.C.11-2016-GOREMAD/GGR14/04/2016109,680.0036,090.003BARRA PARA CONSTRUCCION DE 5/8 in GRADO 60DISTRIBUCION Y CONSTRUCCION SELVA S.A.C.11-2016-GOREMAD/GGR14/04/2016109,680.0036,290.004BARRA PARA CONSTRUCCION DE 3/4 in GRADO 60DISTRIBUCION Y CONSTRUCCION SELVA S.A.C.11-2016-GOREMAD/GGR14/04/2016109,680.0037,300.001LADRILLO  DE ARCILLA de 9x12x24cm de 18 huecosCASTAÑEDA CRUZ SIXTO10817/12/2015393,321.00393,321.001CEMENTO PARA I.E.SIMON BOLIVAR DE MAZUKOZAMORA CORPORATION S.R.L.3410/09/2015889,000.00889,000.001BARRA PARA CONSTRUCCIÓN DE 6MM IN GRADO 60, CODIGO 30102403001324DISTRIBUCION Y CONSTRUCCION SELVA S.A.C.4616/09/201585,698.0027,000.002BARRA DE CONTRUCCIONPROMACO SUR - ORIENTE EMPRESA INDIVIDUAL DE RESPONSABILIDAD LIMITADA. PROMACO SUR -ORIENTE E.I.R.L.4116/09/2015393,523.00393,523.003BARRA DE CONSTRUCCIONZAMORA CORPORATION S.R.L.4416/09/2015229,172.00229,172.004BARRA DE CONSTRUCCIONZAMORA CORPORATION S.R.L.4316/09/2015188,250.00188,250.005BARRA DE CONSTRUCCIONDISTRIBUCION Y CONSTRUCCION SELVA S.A.C.4616/09/201585,698.0025,000.006BARRA DE CONSTRUCCIONDISTRIBUCION Y CONSTRUCCION SELVA S.A.C.4616/09/201585,698.0033,698.00","1SERVICIO DE COLOCACION DE COBERTURA CON LAMINAS TERMO ACUSTICOS Y COLOCACION DE CORREAS METALICAS SOBRE TECHO DE LOS BLOQUES PARA LA OBRA MEJORAMIENTO DE LA OFERTA DE LOS SERVICIOS EDUCATIVOS DELA I.E. SIMON BOLIVAR DE LA LOCALIDAD DE MAZUKO, DISTRITO DE INAMBARI, PROVINCIA DE TAMBOPATA, REGION MADRE DE DIOSINTEGRAL LOGISTIC MARITIME S.R.L.004-2018-GOREMAD/GGR09/02/2018251,754.00251,754.001SERVICIO DE INSTALACIÓN DE SISTEMAS ELÉCTRICOS (MONTAJE ELECTROMECÁNICO DEL SISTEMA DE UTILIZACIÓN) PARA LA OBRA MEJORAMIENTO DE LA OFERTA DE SERVICIO EDUCATIVOS DE LA INSTITUCIÓN EDUCATIVA SIMÓN BOLÍVAR DE LA LOCALIDAD DE MAZUKO, DISTRITO DE TAMBOPATA, REGIÓN ,MADRE DE DIOS META 023.COTAQUISPE VILLENA CARLOS RUBEN062-2017-GOREMAD/GGR28/11/2017138,250.00138,250.001CONTRATACION DE SERVICIOS DE CONFECCION E INSTALACION DE ESTRUCTURA METALICA PARA TECHO DE POLIDEPOERTIVO PARA OBRA  MEJ DE LA OFERTA DE LOS SERVICIOS EDUCATIVOS DE LA IE SIMON BOLIVAR DE MAZUCOADEJ INGENIEROS CONTRATISTAS  S.A.C. - ADEJ S.A.C.CONTRATO Nro. 10-2017-GOREMAD/CS 04/04/2017555,000.00555,000.001SERVICIO DE CONFECCION Y COLOCACION DE PUERTAS DE MADERA TORNILLO para la Obra: ¿MEJORAMIENTO DE LA OFERTA DE SERVICIOS EDUCATIVOS DE LA I.E. SIMON BOLIVAR DE LA LOCALIDAD DE MAZUCO, DISTRITO DE INAMBARI, PROVINCIA DE TAMBOPATA - REGION MADRE DE DIOSPACCO MONTESINOS DOMINGO458028/12/201692,000.0092,000.001SERVICIO DE INSTALACION DE VENTANAS DE VIDRIO TEMPLADO DE 6mm INCOLORO  OBRA: ¿MEJORAMIENTO DE LA OFERTA DE SERVICIOS EDUCATIVOS DE LA I.E. SIMON BOLIVAR DE LA LOCALIDAD DE MAZUCO, DISTRITO DE INAMBARI, PROVINCIA DE TAMBOPATA - REGION MADRE DE DIOS¿;GRUPO MONTANO SOCIEDAD ANONIMA CERRADA - GRUPO MONTANO S.A.C.046-2016/GOREMAD/GGR27/12/2016235,000.00235,000.001SERVICIO DE FABRICACION Y COLOCACION DE ESTRUCTURAS METALICAS Y COBERTURA CON LAMINAS TERMOACUSTICAS CINDULIT  A TODO COSTO OBRA: ¿MEJORAMIENTO DE LA OFERTA DE SERVICIOS EDUCATIVOS DE LA I.E. SIMON BOLIVAR DE LA LOCALIDAD DE MAZUCO, DISTRITO DE INAMBDISEÑOS ACABADOS & DISTRIBUCIONES E.I.R.L.CONTRATO Nro. 008-2017-GOREMAD/GGR15/03/20170.00280,000.001CONTRATACION DE SERVICIO DE PISOS TERRAZOS EN PISOS Y ESCALERAS SEGÚN ESPECIFICACIONES TECNICAS  OBRA: ¿MEJORAMIENTO DE LA OFERTA DE SERVICIOS EDUCATIVOS DE LA I.E. SIMON BOLIVAR DE LA LOCALIDAD DE MAZUCO, DISTRITO DE INAMBARI, PROVINCIA DE TAMBOPATACORPORACION TECSER SOCIEDAD ANONIMA CERRADA - CORPORACION TECSER S.A.C.048-2016-GOREMAD30/12/2016267,663.00267,663.001CONTRATACION DE SERVICIO DE CONFECCION Y COLOCACION DE VENTANAS DE MADERA TORNILLO OBRA: ¿MEJORAMIENTO DE LA OFERTA DE SERVICIOS EDUCATIVOS DE LA I.E. SIMON BOLIVAR DE LA LOCALIDAD DE MAZUCO, DISTRITO DE INAMBARI, PROVINCIA DE TAMBOPATA - REGION MADRINVERSIONES NEPTALY SOCIEDAD COMERCIAL DE RESPONSABILIDAD LIMITADA-""INVERSIONES NEPTALY S.R.L.""042-2016/GOREMAD/GGR16/12/2016150,437.00150,437.001ALQUILER DE LOCAL SEDE DE GOBIERNO REGIONAL DE MADRE DE DIOSCONG HNAS MISIONER DOM DEL R PROV STO T.24-2016-GOREMAD-GGR21/07/2016240,000.00240,000.00"
2234537,238490,06/11/2012,MEJORAMIENTO DE LOS SERVICIOS EDUCATIVOS DE LA IEBR N 52200 PUENTE INAMBARI DEL NIVEL PRIMARIO DEL CP PUENTE INAMBARI DISTRITO DE INAMBARI - PROVINCIA DE TAMBOPATA - REGION MADRE DE DIOS,ACTIVO,PROYECTO DE INVERSION,NO,OPMI DEL GOBIERNO REGIONAL MADRE DE DIOS,AREA FUNCIONAL DE ESTUDIOS Y PROYECTOS - SEDE CENTRAL GOREMAD,UEI  GOBIERNO REGIONAL MADRE DE DIOS-SEDE CENTRAL,VIABLE,NO,EDUCACIÓN - EDUCACIÓN BÁSICA - EDUCACIÓN PRIMARIA,31/05/2013,"2,461,061.00",284,SI,SI,05/06/2017,30/04/2018,"3,822,676.66",0.00,0.00,"3,822,676.66","3,822,676.66","3,277,622.7",85.7 %,"545,053.96",OCT-2013,DIC-2018,,,"1ADQUISICIÓN DE CEMENTO PORTLAND TIPO IP (42.5KG) OBRA MEJ. DE LA OFERTA DE LOS SERVICIOS EDUCATIVOS DE LA I.E.B.R N  52200 PUENTE INAMBARI -NIVEL PRIMARIA-CP PUENTE INAMBARI -HUAPETUE-MANU-MDDFERRETERIA INTEROCEANICA EMPRESA INDIVIDUAL DE RESPONSABILIDAD LIMITADA  - FERRETERIA INTEROCEANICA026-201714/07/2017168,012.00168,012.00",
2234705,95204,26/08/2008,MEJORAMIENTO DEL SERVICIO EDUCATIVO DE LA I.E.B.R. N 52041 JOSE CARLOS MARIATEGUI - CENTRO POBLADO DE SANTA ROSA - DISTRITO DE INAMBARI - PROVINCIA DE TAMBOPATA - REGION MADRE DE DIOS,CERRADO,PROYECTO DE INVERSION,NO,OPMI DEL GOBIERNO REGIONAL MADRE DE DIOS,AREA FUNCIONAL DE ESTUDIOS Y PROYECTOS - SEDE CENTRAL GOREMAD,UEI  GOBIERNO REGIONAL MADRE DE DIOS-SEDE CENTRAL,VIABLE,NO,EDUCACION Y CULTURA - INFRAESTRUCTURA EDUCATIVA - EDIFICACIONES ESCOLARES,17/04/2015,"9,542,094.00","3,776",SI,SI,05/06/2017,23/12/2018,"13,295,921.9",0.00,0.00,"13,295,921.9","13,295,921.9","13,295,717.3",100 %,204.59,DIC-2015,DIC-2020,,,"1CEMENTO PORTLAND PUZOLANICO TIPO IP X 42.50 kgCODECO E.I.R.L8816/11/2018119,950.00119,950.001MATERIALES ELECTRICOS (CONDUCTORES)COMERCIAL VILCA S.A.106415/06/201863,990.0063,990.001ADQUISICION DE MOBILIARIO ESCOLAR, OBRA: ""MEJORAMIENTO DEL SERVICIO EDUCATIVO DE LA I.E.B.R. Nº 52041 JOSE CARLOS MAREATEGUI - CENTRO POBLADO SANTA ROSA - DISTRITO DE INAMBARI - PROVINCIA DE TAMBOPATA - REGION MADRE DE DIOS"" META: 23.CHURA PAUCAR JHON34-2018-GOREMAD/GGR08/06/2018122,530.000.001ADQUISICION DE MOBILIARIO ESCOLAR, OBRA: ""MEJORAMIENTO DEL SERVICIO EDUCATIVO DE LA I.E.B.R. Nº 52041 JOSE CARLOS MAREATEGUI - CENTRO POBLADO SANTA ROSA - DISTRITO DE INAMBARI - PROVINCIA DE TAMBOPATA - REGION MADRE DE DIOS"" META: 23.PACCO MONTESINOS DOMINGO9813/12/2018102,520.00102,520.001ADQUISICION DE MATERIALES ELECTRICOS (LUMINARIAS), OBRA: ""MEJORAMIENTO DEL SERVICIO EDUCATIVO DE LA I.E.B.R. Nº 52041 JOSE CARLOS MAREATEGUI - CENTRO POBLADO SANTA ROSA - DISTRITO DE INAMBARI - PROVINCIA DE TAMBOPATA - REGION MADRE DE DIOS"" META: 23.SERVICIOS Y CONSTRUCTORA LOS APUS SOCIEDAD ANONIMA CERRADA - SERCONS LOS APUS S.A.C.89422/05/201850,890.0050,890.001ADQUISICION DE AGREGADOS (ARENA GRUESA, PIEDRA ZARANDEADA Y PIEDRA CANTO RODADO)CONCORCIO26-2018-GOREMAD/GGR18/05/2018263,840.00263,840.001ADQUISICION DE VARILLA DE ACERO CORRUGADO FY = 4200 KG/CM2 GRADO  60, OBRA: MEJORAMIENTO DEL SERVICIO EDUCATIVO DE LA IEBR JOSE CARLOS MARIATEGUI - CENTRO POBLADO DE SANTA ROSA - DISTRITO DE INAMBARI - RPOVINCIA DE TAMBOPATA - REGION MADRE DE DIOS.COMERCIAL ARIANA EMPRESA INDIVIDUAL DE RESPONSABILIDAD LIMITADA017-2018-GOREMAD/GGR23/04/2018156,000.00156,000.001ADQUISICION DE CEMENTO PORTLAND TIPO IP X 42.5 KG PARA LA OBRA MEJORAMIENTO DEL SERVICIO EDUCATIVO DE LA I.E.B.R. 52041 JOSE CARLOS MARIATEGUI CENTRO POBLADO DE SANTA ROSA DISTRITO DE INAMBARI PROVINCIA DE TAMBOPATA REGION MADRE DE DIOSZAMORA CORPORATION S.R.L.014-2018-GOREMAD/GGR02/04/2018112,000.00112,000.001ADQUISICION DE TIRAFON, PLANCHA ONDULADA DE FIBROCEMENTO Y CUMBRERA GRAN ONDA PARA LA COBERTURA A DOS AGUAS PARA LA OBRA: MEJORAMIENTO DE LA OFERTA DE LOS SERVICIOS EDUCATIVOS DE LA I.E.B.R. N°52041, JOSE CARLOS MARIATEGUI- CENTRO POBLADO SANTA ROSACASAS Y COLORES SOCIEDAD COMERCIAL DE RESPONSABILIDAD LIMITADA - CASAS Y COLORES S.R.L.069-2017-GOREMAD/GGR12/12/201799,112.0099,112.001ADQUISICIÓN 118,200 UNIDADES DE LADRILLO DE ARCILLA DE 9cm X 13cm X 24cm DE 18 HUECOS  OBRA MEJ. DE LOS SERVICIOS EDUCATIVOS DE LA I.E.B.R 52041 JOSE CARLOS MARIATEGUI-CPM SANTA ROSA -INAMBARI-MDDCOMERCIALIZADORA EL YUYO EMPRESA INDIVIDUAL DE RESPONSABILIDAD LIMITADA66-2017-GOREMAD/OEC- PRIMERA CONVOCATORIA05/12/2017158,388.00158,388.001ADQUISICIÓN DE CEMENTO PORTLAND TIPO IP (42.5KG) OBRA MEJ. DE LOS SERVICIOS EDUCATIVOS DE LA I.E.B.R 52041 JOSE CARLOS MARIATEGUI-CPM SANTA ROSA -INAMBARI-MDDCODECO E.I.R.L63-2017-GOREMAD/GGR28/11/2017621,980.00621,980.001BARRA PARA CONSTRUCCION DE 3/8 in GRADO 60COMERCIALIZADORA GRUPO SANTA FE SOCIEDAD ANONIMA CERRADA - COMERCIALIZADORA GRUPO SANTA FE S.A.C.022-201727/06/2017218,000.00218,000.00","1SERVICIO DE FABRICACION E INSTALACION DE ESTRUCTURA METALICA PARABOLICA PARA POLIDEPORTIVO, OBRA: ""MEJORAMIENTO DEL SERVICIO EDUCATIVO DE LA I.E.B.R. Nº 52041 JOSE CARLOS MAREATEGUI - CENTRO POBLADO SANTA ROSA - DISTRITO DE INAMBARI - PROVINCIA DE TA;A & D INGENIEROS; SOCIEDAD ANONIMA CERRADA72-2018/GOREMAD/GGR04/10/2018255,000.00255,000.001SERVICIO SUMINISTRO E INSTALACION DE VENTANA DE ALUMINIO CON VIDRIO TEMPLADO DE 6MM CON LAMINA DE SEGURIDAD PARA LA OBRA MEJORAMIENTO DEL SERVICIO EDUCATIVO DE LA I.E.B.R. 52041 JOSE CARLOS MARIATEGUI CENTRO POBLADO DE SANTA ROSA DISTRITO DE INAMBARSGRUPO MONTANO SOCIEDAD ANONIMA CERRADA - GRUPO MONTANO S.A.C.38-2018-GOREMAD/GGR14/06/2018137,500.000.001SERVICIO SUMINISTRO E INSTALACION DE VENTANA DE ALUMINIO CON VIDRIO TEMPLADO DE 6MM CON LAMINA DE SEGURIDAD PARA LA OBRA MEJORAMIENTO DEL SERVICIO EDUCATIVO DE LA I.E.B.R. 52041 JOSE CARLOS MARIATEGUI CENTRO POBLADO DE SANTA ROSA DISTRITO DE INAMBARSTORRES ORCON DANIEL ALAN9611/12/2018172,600.00172,600.00"
