codigo_unico,snip,fecha_registro,nombre_inversion,estado,tipo_inversion,programa_pmi,ompi,uf,uei,situacion,decreto_emergencia,cadena_funcional,viabilidad_aprobacion,costo_aprobado,beneficiarios,expediente_tecnico,reg_seguimiento,inicio_ejecucion,fin_ejecucion,inversion_actualizado,sol_controversias,carta_fianza,inver_total,costo_inversion,devengado_acumulado,avance_financiero_acum,saldo,fecha_primerdevengado,fecha_ultimodevengado,seaceobra,seaceconsul,seacebien,seaceserv
2290511,332037,31/08/2015,MEJORAMIENTO Y AMPLIACION DEL SERVICIO EDUCATIVO EN LOS NIVELES DE PRIMARIA Y SECUNDARIA DE LA I.E.B.R. N 52194 CAP.PNP. ALIPIO PONCE VASQUEZ - DISTRITO TAMBOPATA - PROVINCIA DE TAMBOPATA - REGIÓN MADRE DE DIOS,ACTIVO,PROYECTO DE INVERSION,SI,OPMI DEL GOBIERNO REGIONAL MADRE DE DIOS,AREA FUNCIONAL DE ESTUDIOS Y PROYECTOS - SEDE CENTRAL GOREMAD,UEI  GOBIERNO REGIONAL MADRE DE DIOS-SEDE CENTRAL,VIABLE,NO,EDUCACIÓN - EDUCACIÓN BÁSICA - EDUCACIÓN PRIMARIA,27/06/2017,"23,434,631.00",807,SI,SI,15/03/2019,04/06/2022,"23,284,798.14",0.00,0.00,"23,284,798.14","23,284,798.14","18,308,498.58",78.6 %,"4,976,299.56",OCT-2017,FEB-2022,,,"1PIEDRA ZARANDEADA DE 1/2 inINVERSIONES CORPORATIVAS MELQUI S.A.C.000104717/06/202141,850.0041,850.001BARRA PARA CONSTRUCCION DE 1/2 in GRADO 60ROODSUR SOCIEDAD COMERCIAL DE RESPONSABILIDAD LIMITADA2516/06/2021153,990.00153,990.001CABLES ELECTRICOSINVERSIONES MARANGANI S.R.L.754-202118/05/202145,450.0045,450.001ADQUISICION DE CONCRETO PREMEZCLADO DE 140 KG/CM2 INCLUYE BOMBEO Y CONCRETO PREMEZCLADO DE 210 KG/CM2 CON ADITIVO IMPERMEABILIZANTEIMPORTACION RENTA DE MAQUINARIAS DE CONSTRUCCION SOCIEDAD ANÓNIMA CERRADA - IMAQ S.A.C.011-2021-GOREMAD/GGR07/05/2021189,316.00189,316.001ADQUISICION DE CONCRETO PREMEZCLADOIMPORTACION RENTA DE MAQUINARIAS DE CONSTRUCCION SOCIEDAD ANÓNIMA CERRADA - IMAQ S.A.C.10-2021-GOREMAD/GGR07/05/2021380,348.00380,348.001ADQUISICIÓN DE LUMINARIASMARFLOR CORP. E.I.R.L.68611/05/202181,472.0081,472.001HORMIGONMULTISERVICIOS Y REPRESENTACIONES VERA  EMPRESA INDIVIDUAL DE REPONSABILIDAD LIMITADA49013/04/202154,000.0054,000.001ADQUISICION DE TRIPLAY TABLERO CONTRACHAPADO FENOLICO 18MM X 1.22 X 2.44EMPRESA BIACCI S.A.C.0722/04/2021107,000.00107,000.001ADQUISICION DE LADRILLOCOMERCIAL ARIANA EMPRESA INDIVIDUAL DE RESPONSABILIDAD LIMITADA1713/05/2021226,460.00226,460.001CEMENTO PORTLAND PUZOLANICO TIPO IP X 42.50 kgFERRETERIA INTEROCEANICA EMPRESA INDIVIDUAL DE RESPONSABILIDAD LIMITADA  - FERRETERIA INTEROCEANICACONTRATO N° 003-2021-GOREMAD/GGR07/04/2021146,229.00146,229.001CEMENTO PORTLAND PUZOLANICO TIPO IP X 42.50 kgGRUPO SANTA FE SOCIEDAD ANONIMA CERRADA - GRUPO SANTA FE S.A.C.16-2020-GOREMAD/GGR15/06/2020218,310.00218,310.001VARILLAS DE ACERO CORRUGADO FY=4200 KG/CM2 GRADO 60X9MGRUPO SANTA FE SOCIEDAD ANONIMA CERRADA - GRUPO SANTA FE S.A.C.015-2020-GOREMAD/GGR15/06/2020349,056.00349,056.001ADQUISICION DE VENTILADOR ELECTRICO PARA TECHOCOMERCIAL IMPORTADORA MILAGROS E.I.R.L.6531/01/202050,589.0050,589.001ADQUISICION DE PUNTALES METALICOS DE ALTURA VARIABLE DE 2A4 MTS TUBO GALVANIZADO DE 2 IN X 4 PARA LA OBRA MEJORAMIENTO Y AMPLIACION DEL SERVICIO EDUCATIVO EN LOS NIVELES DE PRIMARIA Y SECUNDARIA DE LA IEBR N 52194 CAP ALIPIO PONCE VASQUEZ DISTRITOBIENES SERVICIOS GVB E.I.R.L.58-2019-GOREMAD/GGR10/09/2019108,000.00108,000.001ADQUISICIÓN DE TRIPLAY, PARA LA OBRA: ""MEJORAMIENTO Y AMPLIACIÓN DEL SERVICIO EDUCATIVO EN LOS NIVELES DE PRIMARIA Y SECUNDARIA DE LA I.E.B.R.N 52194 CAP. PNP. ALIPIO PENCE VAZQUEZ - DISTRITO TAMBOPATA - PROVINCIA DE TAMBOPATA REGION MADRE DE DIOS""TECHOS MULTIFORMAS E.I.R.L.115209/07/201961,100.0061,100.001ADQUISICION DE CERAMICO, PORCELANATO PARA LA OBRA: ¿MEJORAMIENTO Y AMPLIACION DEL SERVICIO EDUCATIVO EN LOS NIVELES DE PRIMARIA Y SECUNDARIA DE LA I.E.B.R. Nº 52194 CAP. PNP. ALIPIO PONCE VASQUEZ-DISTRITO TAMBOPATA-PROVINCIA TAMBOPATA-REGION MADRE DEINVERSIONES FERRETERA EL INKA E.I.R.L.111005/07/201979,182.0079,182.001ADQUISICION DE MADERA CORRIENTE DE DIFERENTES MEDIDAS, PARA LA OBRA. MEJORAMIENTO Y AMPLIACION DEL SERVICIO EDUCATIVO EN LOS NIVELES PRIMARIA Y SECUNDARIA DE LA I.E.B.R. Nª 52194 CAP. PNP. ALIPIO PONCE VASQUEZ-DISTRITO DE TAMBOPATA-PROVINCIA DE TAMBOINVERSIONES CORPORATIVA JODAV E.I.R.L.42-2019-GOREMAD/GGR24/07/20190.00234,563.001ADQUISICION DE ARENA FINA, ARENA GRUESA Y PIEDRA CHANCADA ½¿ (AGREGADO GRUESO DE ½ PARA CONCRETO), PARA LA OBRA: ¿MEJORAMIENTO Y AMPLIACION DEL SERVICIO EDUCATIVO EN LOS NIVELES DE PRIMARIA Y SECUNDARIA DE LA I.E.B.R. Nº 52194 CAP. PNP. ALIPIO PONCEINVERSIONES CORPORATIVAS MELQUI S.A.C.17-2019-GOREMAD/GGR04/06/2019118,735.00118,735.001ADUISICION DE LADRILLOS DE ARCILLA PARA LA OBRA MEJORAMIENTO Y AMPLIACION DEL SERVICIO EDUCATIVO EN LOS NIVELES DE PRIMARIA Y SECUNDARIA DE LA I.E.B.R. Nro. 52194 CAP.PNP. ALIPIO PONCE VASQUEZ - DISTRITO TAMBOPATA - PROVINCIA DE TAMBOPATA - REGION MALADRILLERA DEL SUR S.R.L.CONTRATO N° 13-2019-GOREMAD/GGR22/05/2019120,879.00120,879.001ADQUISICION DE CEMENTO PORTLAND PUZOLANICO TIPO IP X 42.5 KG  PARA LA OBRA MEJORAMIENTO Y AMPLIACION DEL SERVICIO EDUCATIVO EN LOS NIVELES DE PRIMARIA Y SECUNDARIA DE LA I.E.B.R. Nro. 52194 CAP.PNP. ALIPIO PONCE VASQUEZ - DISTRITO TAMBOPATA - PROVINCIA DE TAMBOPATA - REGION MADRE DE DIOSGRUPO SANTA FE SOCIEDAD ANONIMA CERRADA - GRUPO SANTA FE S.A.C.0802/05/2019398,918.00398,918.001ADQUISICION DE VARILLA DE ACERO CORRUGADO FY=4200 KG/CM2 GRADO 60 DE DIFERENTES MEDIDAS, PARA LA OBRA ¿MEJORAMIENTO Y AMPLIACION DEL SERVICIO EDUCATIVO EN LOS NIVELES DE PRIMARIA Y SECUNDARIA DE LA I.E.B.R. Nº 52194 CAP. PNP. ALIPIO PONCE VASQUEZ-DISCOMERCIAL ARIANA EMPRESA INDIVIDUAL DE RESPONSABILIDAD LIMITADA03-2019-GOREMAD/GGR23/04/2019287,000.00287,000.00","1SERVICIO DE INSTALACION DEL TRANSFORMADOR DE 75 KVA PARA EL SISTEMA DE DISTRIBUCION ELECTRICA PARA LA OBRA: ""MEJORAMIENTO Y AMPLIACION DEL SERVICIO EDUCATIVO EN LOS NIVELES DE PRIMARIA Y SECUNDARIA DE LA I.E.B.R. N 52194 CAP.PNP. ALIPIO PONCE VASQUEZCONSORCIO ATENTO2479-202118/08/202198,372.0098,372.001SERVICIO DE ELABORACION Y CONFECCION DE PUERTAS DE MADERAPACCO MONTESINOS DOMINGO236704/08/202171,350.0071,350.001SERVICIO DE INSTALACION DE COBERTURA METALICA DE POLIDEPORTIVO A TODO COSTOCONSTRUCSUR PROYECTOS S.A.C.3522/07/2021234,400.00234,400.001SERVICIO DE CONFECCION E INSTALACION DE TAPASOL METALICO (CELOSIA METALICA COMPUESTA) T-1 PARA LA OBRA: ""MEJORAMIENTO Y AMPLIACION DEL SERVICIO EDUCATIVO EN LOS NIVELES DE PRIMARIA Y SECUNDARIA DE LA I.E.B.R. N 52194 CAP.PNP. ALIPIO PONCE VASQUEZ - DMAMANI CUCHICARI WILSON000185417/06/202168,500.0068,500.001SERVICIO DE INSTALACION DE COBERTURA METALICA DE ACERO ALUZIM A TODO COSTOADEJ INGENIEROS CONTRATISTAS  S.A.C. - ADEJ S.A.C.2231/05/2021197,216.00197,216.00"
2291033,332522,05/09/2019,"MEJORAMIENTO DE LOS SISTEMAS DE GESTION AMBIENTAL DE LOS GOBIERNOS LOCALES EN LOS DISTRITOS DE IÑAPARI, IBERIA Y TAHUAMANU DE LA  PROVINCIA DE TAHUAMANU - DEPARTAMENTO DE MADRE DE DIOS",ACTIVO,PROYECTO DE INVERSION,SI,OPMI DE LA MUNICIPALIDAD PROVINCIAL DE TAHUAMANU,UF DE LA MUNICIPALIDAD PROVINCIAL DE TAHUAMANU,UEI DE LA MUNICIPALIDAD PROVINCIAL DE TAHUAMANU,VIABLE,NO,"PLANEAMIENTO, GESTIÓN Y RESERVA DE CONTINGENCIA - GESTIÓN - INFRAESTRUCTURA Y EQUIPAMIENTO",06/09/2019,"1,061,781.75","11,234",NO,SI,01/01/2020,01/03/2020,"1,061,781.75",0.00,0.00,"1,061,781.75","1,061,781.75","27,481.93",2.6 %,"1,034,299.82",NOV-2020,DIC-2020,,,,
2292717,334044,15/09/2015,"MEJORAMIENTO Y AMPLIACION DEL SERVICIO DE SEGURIDAD CIUDADANA EN EL AMBITO DE LA CIUDAD DE PUERTO MALDONADO, DISTRITO DE TAMBOPATA, PROVINCIA DE TAMBOPATA - MADRE DE DIOS",ACTIVO,PROYECTO DE INVERSION,SI,OPMI DE LA MUNICIPALIDAD PROVINCIAL DE TAMBOPATA,UF DE LA MUNICIPALIDAD PROVINCIAL DE TAMBOPATA,UEI DE LA MUNICIPALIDAD PROVINCIAL DE TAMBOPATA,VIABLE,NO,ORDEN PÚBLICO Y SEGURIDAD - ORDEN INTERNO - SEGURIDAD VECINAL Y COMUNAL,18/09/2015,"9,308,913.00","108,546",SI,SI,01/03/2017,10/01/2024,"11,530,765.24",0.00,0.00,"11,530,765.24","11,530,765.24","6,575,778.55",57 %,"4,954,986.69",NOV-2015,DIC-2021,,,"1ADQUISICI¿N DE CHALECOS ANTIBALAS PARA EL PROYECTO: MEJORAMIENTO Y AMPLIACI¿N DEL SERVICIO DE SEGURIDAD CIUDADANA EN EL AMBITO DE LA CIUDAD DE PUERTO MALDONADO, PROVINCIA DE TAMBOPATA ¿ MADRE DE DIOSORTEGA CHAVEZ RUBEN OCTAVIOORDEN DE COMPRA N° 00001355-202124/11/202165,960.0065,960.001ADQUISICI¿N DE ACERO CORRUGADO PARA EL PROYECTO: MEJORAMIENTO Y AMPLIACI¿N DEL SERVICIO DE SEGURIDAD CIUDADANA EN EL AMBITO DE LA CIUDAD DE PUERTO MALDONADO, PROVINCIA DE TAMBOPATA ¿ MADRE DE DIOSCOMERCIAL ARIANA EMPRESA INDIVIDUAL DE RESPONSABILIDAD LIMITADAORDEN DE COMPRA N° 0001358-202124/11/202135,851.0035,851.001ADQUISICION DE MATERIALES E INSUMOS PARA ENCHAPADOS PISOS Y MUROS PARA EL PROYECTO "" MEJORAMIENTO Y AMPLIACION DEL SERVICIO DE SEGURIDAD CIUDADANA EN EL AMBITO DE LA CIUDAD DE PUERTO MALDONADO, DISTRITO DE TAMBOPATA, PROVINCIA DE TAMBOPATA - MADRE DEINVERSIONES FERRETERA EL INKA E.I.R.L.ORDEN DE COMPRA N°31410/04/201974,348.0074,348.001ADQUISICION LADRILLO DE DIFERENTES MEDIDAS, PARA EL PROYECTO: MEJORAMIENTO Y AMPLIACION DEL SERVICIO DE SEGURIDAD CIUDADANA EN EL AMBITO DE LA CIUDAD DE PUERTO MALDONADO, DISTRITO Y PROVINCIA DE TAMBOPATA - MADRE DE DIOS.COMERCIALIZADORA EL YUYO EMPRESA INDIVIDUAL DE RESPONSABILIDAD LIMITADAORDEN DE COMPRA N° 935-201805/10/201862,148.0062,148.001ADQUISICION CONCRETO PREMEZCLADO FC=140 KG/CM2, FC=175 KG/CM2 Y FC=210 KG/CM2, PARA EL PROYECTO: MEJORAMIENTO Y AMPLIACION DEL SERVICIO DE SEGURIDAD CIUDADANA EN EL AMBITO DE LA CIUDAD DE PUERTO MALDONADO, DISTRITO Y PROVINCIA DE TAMBOPATA - MADRE DEIMPORTACION RENTA DE MAQUINARIAS DE CONSTRUCCION SOCIEDAD ANÓNIMA CERRADA - IMAQ S.A.C.019-2018-MPT-GM11/09/2018132,006.00132,006.001CONTRATACIÓN DE CEMENTO PORTLAND TIPO IP (42.5 KG) PARA LA OBRA: MEJORAMIENTO Y AMPLIACION DE LOS SERVICIOS DE SEGURIDAD CIUDADANA EN LA CIUDAD DE PUERTO MALDONADO, DISTRITO Y PROVINCIA DE TAMBOPATA - REGIÓN DE MADRE DE DIOS.FERRETERIA INTEROCEANICA EMPRESA INDIVIDUAL DE RESPONSABILIDAD LIMITADA  - FERRETERIA INTEROCEANICA017-2018-MPT-GM07/09/201861,830.0061,830.001ADQUISICION DE VARILLAS DE ACERO CORRUGADO FY=4200 KG/CM2 GRADO 60 DE DIFERENTES MEDIDAS, PARA EL PROYECTO:MEJORAMIENTO Y AMPLIACION DEL SERVICIO DE SEGURIDAD CIUDADANA EN EL AMBITO DE LA CIUDAD DE PUERTO MALDONADO, DISTRITO Y PROVINCIA DE TAMBOPATAFERRETERIA INTEROCEANICA EMPRESA INDIVIDUAL DE RESPONSABILIDAD LIMITADA  - FERRETERIA INTEROCEANICA018-2018-MPT-GM07/09/2018108,847.00108,847.00","1CONTRATACION DE SERVICIO DE SUMINISTRO, CONFECCION E INSTALACION A TODO COSTO DE MODULOS METALICOS DE SS.HH. PUERTAS VENTANAS Y OTRAS INSTALACIONES METÁLICAS PARA LA OBRA ""MEJORAMIENTO Y AMPLIACION DEL SERVICIO DE SEGURIDAD CIUDADANA EN EL ÁMBITO DETORRES ORCON DANIEL ALANCONTRATO N° 023-2019-MPT-GM11/07/2019109,000.00109,000.001CONTRATACIÓN DEL SERVICIO DE SUMINISTRO, CONFECCIÓN Y MONTAJE A TODO COSTO DEL TECHO METÁLICO TIPO PARA  LA OBRA ""MEJORAMIENTO Y AMPLIACIÓN DEL SERVICIO DE SEGURIDAD CIUDADANA EN EL ÁMBITO DE LA CIUDAD DE PUERTO MALDONADO, DISTRITO DE TAMBOPATA, PROVINGENIEROS MANEJANDO RECURSO HIDRICO Y MEDIO AMBIENTE SOCIEDAD ANONIMA CERRADACONTRATO N° 019-2019-MPT-GM04/07/201990,000.0090,000.00"
2300749,338127,22/10/2015,"AMPLIACION Y MEJORAMIENTO DEL SISTEMA DE AGUA Y DESAGUE DEL CENTRO POBLADO DE CHOQUE, DISTRITO DE HUEPETUHE, PROVINCIA DE MANU - REGION MADRE DE DIOS",CERRADO,PROYECTO DE INVERSION,NO,OPMI DEL GOBIERNO REGIONAL MADRE DE DIOS,SUB-REGION MANU,UEI 1392 SUB REGION MANU,VIABLE,NO,SANEAMIENTO - SANEAMIENTO - SANEAMIENTO RURAL,18/08/2016,"3,470,345.00",459,SI,SI,01/12/2016,15/12/2019,"3,941,033.09",0.00,0.00,"3,941,033.09","3,941,033.09","3,930,535.61",99.7 %,"10,497.47",DIC-2016,DIC-2020,,,"1ADQUISICIÓN DE TUBO ESTRUCTURAL, ANGULO DE FIERRO, MALLA OLÍMPICA Y ALAMBRE DE PÚA PARA LA META: 0001MAMANI CAHUANA CLAUDIO FERMIN449-201910/10/201956,720.0056,720.001Adquisición e Instalación de Puertas de Madera para Los Servicios Higiénicos para la Sec. Func. 001.CHURA PAUCAR JHON387-201910/09/201968,000.0068,000.001MEDIDOR DE AGUA POTABLE DE 1/2""COMERCIAL B & R SOCIEDAD COMERCIAL DE RESPONSABILIDAD LIMITADA-COMERCIAL B & R S.R.L.26711/07/201955,646.0055,646.001ADQUISICION DE CERAMICOS  DIFERENTES MEDIDAS PARA LA META 001INVERSIONES FERRETERA EL INKA E.I.R.L.293-201923/07/201957,077.0057,077.001ADQUISICION DE  CEMENTO PORTLAND TIPO  IP (42.5kLG) PARA LA META  001FERRETERIA INTEROCEANICA EMPRESA INDIVIDUAL DE RESPONSABILIDAD LIMITADA  - FERRETERIA INTEROCEANICA00816/04/2019108,000.00108,000.001ADQUISICIÓN DE PIEDRA DE RIÓ (canto rodado) MAYOR IGUAL A 4"" Y MENOR  IGUAL A 8 PARA LA META  001""MINERA TRANSOCEANICA SOCIEDAD ANONIMA CERRADA004-201902/04/201963,000.0063,000.001BARRA PARA CONSTRUCCION DE 3/8 in GRADO 60EMPRESA  ZOHE SAC034-201905/03/201957,000.0057,000.001Adquisición de Tubería y Accesorios de PVC  Para la Linea de Conducción y Red de   Distribución de Agua Potable para la Meta 27TECNICAS CONSTRUCTIVAS Y REPRESENTACIONES SOCIEDAD ANONIMA CERRADA006-2019-GOREMAD/GSR-MANU-G17/01/201943,994.0043,994.001Adquisición de Teja Andina y Accesorios para  Servicios Higiénicos  Intradomiciliarios.COMERCIAL B & R SOCIEDAD COMERCIAL DE RESPONSABILIDAD LIMITADA-COMERCIAL B & R S.R.L.005-2019-GOREMAD/GSR-MANU16/01/201966,400.0066,400.001Adquisición de Aparatos Sanitarios con   Accesorios.HUANCOR PERU SOCIEDAD ANONIMA CERRADA004-2019-GOREMAD/GSR-MANU16/01/201960,270.0060,270.001Adquisición de120 Unds Gaviones  de Acero Galvanizado con recubrimiento de PVC de 5.00  x 1.00m x 1.00m, 40 Unds. Gaviones de Acero  Galvanizado con recubrimiento de PVC de 5.00m x 1.50m x 1.00m y 100 Unds Gavión Tipo Colcho de Acero Galvanizado  con recubrimiento de PVC de 5.00m x 2.00 x 0.30mCOMERCIAL ARIANA EMPRESA INDIVIDUAL DE RESPONSABILIDAD LIMITADA001-2019-GOREMAD/GSR-MANU-G14/01/2019102,717.00102,717.001Adquisición de Biodigestor de  600 y 7000 litros Incluido AccesoriosPROCON SOCIOS SOCIEDAD COMERCIAL DE RESPONSABILIDAD LIMITADA - PROCON SOCIOS S.R.L.1006/11/2018110,090.00110,090.001Adquisición de Tubería y Accesorios para  Alcantarillado y drenaje.TECNICAS CONSTRUCTIVAS Y REPRESENTACIONES SOCIEDAD ANONIMA CERRADA1114/11/2018126,125.00126,125.00",
2300763,338201,22/10/2015,"AMPLIACION Y MEJORAMIENTO DEL SISTEMA DE AGUA POTABLE Y SANEAMIENTO INTEGRAL EN EL CENTRO POBLADO DE NUEVA , DISTRITO DE HUEPETUHE - MANU - MADRE DE DIOS",ACTIVO,PROYECTO DE INVERSION,SI,OPMI DEL GOBIERNO REGIONAL MADRE DE DIOS,SUB-REGION MANU,,VIABLE,NO,SANEAMIENTO - SANEAMIENTO - SANEAMIENTO RURAL,25/04/2017,"4,062,198.00","1,030",NO,NO,,,"4,062,198.00",0.00,0.00,"4,062,198.00","4,062,198.00","170,000.59",4.2 %,"3,892,197.41",OCT-2017,DIC-2019,,,,
2301287,340488,18/11/2015,"MEJORAMIENTO DE LAS CAPACIDADES TÉCNICO OPERATIVO PARA EL SANEAMIENTO FISICO LEGAL DE LA PROPIEDAD RURAL  EN LA  DIRECCION REGIONAL DE AGRICULTURA MDD. PROVINCIAS MANU, TAHUAMANU Y COMUNIDADES NATIVAS  REGION MADRE DE DIOS.",ACTIVO,PROYECTO DE INVERSION,SI,OPMI DEL GOBIERNO REGIONAL MADRE DE DIOS,UF DIRECCIÓN REGIONAL DE AGRICULTURA,UEI DIRECCION REGIONAL DE AGRICULTURA,VIABLE,NO,AGROPECUARIA - AGRARIO - INOCUIDAD AGROALIMENTARIA,11/11/2016,"15,792,738.00","10,617",SI,SI,01/01/2021,31/03/2023,"11,025,427.4",0.00,0.00,"11,025,427.4","11,025,427.4","2,520,353.97",22.9 %,"8,505,073.43",MAR-2019,ENE-2022,,,"1CAMIONETA PICK UP CABINA DOBLE 4 X 4  ""PROYECTO MEJORAMIENTO DE CAPACIDADES TECNICO OPERATIVO PARA EL SANEAMIENTO FISCO LEGAL DE LA PROPIEDAD RURAL EN LA DIRECCI¿N REGIONAL DE AGRICULTURA DE MADRE DE DIOS - PROVINCIA DE MANU, TAHUAMANU Y COMUNIDADES NATIVAS REGION MADRE DE DIOS"".VEHICULOS Y EQUIPOS SOCIEDAD ANONIMA CERRADAORDEN DE COMPRA N° 195-202118/11/2021182,490.00182,490.001ADQUISICIÓN DE GPS DIFERENCIAL SUB METRICO Y ACCESORIOS PARA EL PROYECTO ¿MEJORAMIENTO DE LAS CAPACIDADES TÉCNICO OPERATIVO PARA EL SANEAMIENTO FISICO LEGAL DE LA PROPIEDAD RURAL EN LA DIRECCION REGIONAL DE AGRICULTURA MDD. PROVINCIAS MANU, TAHUAMANU Y COMUNIDADES NATIVAS REGION MADRE DE DIOSGEO SYSTEMS S.A.C.contrato N°004-2021-GOREMAD-GRDE-DRA23/06/2021130,350.00130,350.00",
2302288,338599,24/11/2015,"MEJORAMIENTO Y AMPLIACION DE LOS SERVICIOS DEPORTIVOS DEL COMPLEJO MUNICIPAL DE LA CIUDAD DE PUERTO MALDONADO, DISTRITO DE TAMBOPATA, PROVINCIA DE TAMBOPATA - MADRE DE DIOS",ACTIVO,PROYECTO DE INVERSION,SI,OPMI DE LA MUNICIPALIDAD PROVINCIAL DE TAMBOPATA,UF DE LA MUNICIPALIDAD PROVINCIAL DE TAMBOPATA,UEI DE LA MUNICIPALIDAD PROVINCIAL DE TAMBOPATA,VIABLE,NO,CULTURA Y DEPORTE - DEPORTES - INFRAESTRUCTURA DEPORTIVA Y RECREATIVA,30/11/2015,"10,877,366.00","45,385",SI,SI,01/02/2018,15/05/2023,"8,420,866.02",0.00,0.00,"8,420,866.02","8,420,866.02","4,457,600.96",52.9 %,"3,963,265.05",JUN-2016,DIC-2021,,,"1ADQUISICIÓN DE PISOS CERÁMICOS ANTIDESLIZANTES E INSUMOS COMPLEMENTARIOS, PARA LA OBRA: ""MEJORAMIENTO Y AMPLIACIÓN DE LOS SERVICIOS DEPORTIVOS DEL COMPLEJO MUNICIPAL DE LA CIUDAD DE PUERTO MALDONADO, DISTRITO DE TAMBOPATA, PROVINCIA DE TAMBOPATA - MACOMERCIAL ARIANA EMPRESA INDIVIDUAL DE RESPONSABILIDAD LIMITADAORDEN DE COMPRA N°45020/05/201972,606.0072,606.001ADQUISICIÓN DE LADRILLO DE DIFERENTES MEDIDAS PARA LA OBRA MEJORAMIENTO Y AMPLIACIÓN DE LOS SERVICIOS DEPORTIVOS DEL COMPLEJO MUNICIPAL DE LA CIUDAD DE PUERTO MALDONADO, DISTRITO Y PROVINCIA DE TAMBOPATA, REGIÓN DE MADRE DE DIOS.COMERCIALIZADORA EL YUYO EMPRESA INDIVIDUAL DE RESPONSABILIDAD LIMITADA1123-2018-MPT29/11/201858,795.0058,795.001ADQUISICION DE CEMENTO PORTLAND TIPO IP (42.5 KG) PARA EL PROYECTO: MEJORAMIENTO Y AMPLIACION DE LOS SERVICIOS DEPORTIVOS DEL COMPLEJO MUNICIPAL DE LA CIUDAD DE PUERTO MALDONADO, DISTRITO Y PROVINCIA DE TAMBOPATA - MADRE DE DIOS.INGENIEROS MANEJANDO RECURSO HIDRICO Y MEDIO AMBIENTE SOCIEDAD ANONIMA CERRADACONTRATO N° 029-2018-MPT-GM07/12/201881,000.0081,000.001ADQUISICION CONCRETO PREMEZCLADO  FC=210 KG/CM2, CON PIEDRA DE CANTO RODADO 1 PARA EL PROYECTO: MEJORAMIENTO Y AMPLIACION DE LOS SERVICIOS DEPORTIVOS DEL COMPLEJO MUNICIPAL DE LA CIUDAD DE PUERTO MALDONADO, DISTRITO Y PROVINCIA DE TAMBOPATA - MADRE DE DIOS.IMPORTACION RENTA DE MAQUINARIAS DE CONSTRUCCION SOCIEDAD ANÓNIMA CERRADA - IMAQ S.A.C.CONTRATO N° 030-2018-MPT-GM07/12/2018146,150.00146,150.001ADQUISICION DE BARRAS DE ACERO CORRUGADO FY=4200 KG/CM2 GRADO 60 DE DIFERENTES MEDIDAS, PARA EL PROYECTO: MEJORAMIENTO Y AMPLIACION DE LOS SERVICIOS DEPORTIVOS DEL COMPLEJO MUNICIPAL DE LA CIUDAD DE PUERTO MALDONADO, DISTRITO Y PROVINCIA DE TAMBOPATACOMERCIAL ARIANA EMPRESA INDIVIDUAL DE RESPONSABILIDAD LIMITADA025-2018-MPT-GM19/11/2018139,900.00139,900.001ADQUISICION DE MADERA DE  DIFERENTES MEDIDAS PARA LA OBRA MEJORAMIENTO Y AMPLIACION DE LOS SERVICIOS DEPORTIVOS DEL COMPLEJO MUNICIPAL DE LA CIUDAD DE PUERTO MALDONADO, DISTRITO Y PROVINCIA DE TAMBOPATA, REGION DE MADRE DE DIOS.PARI MAMANI MARGARITAORDEN DE COMPRA N° 1066-2018-MPT05/11/201858,653.0058,653.00","1CONTRATACION DE SERVICIO DE INSTALACION DE ESTRUCTURA METALICACONSORCIO MALDONADOCONTRATO N° 002-2019-MPT-GM10/04/2019255,000.00255,000.00"
2303718,342694,09/12/2015,"MEJORAMIENTO Y AMPLIACION DEL SISTEMA DE AGUA POTABLE Y SANEAMIENTO EN EL CENTRO POBLADO DE LAS MERCEDES , DISTRITO DE LABERINTO - TAMBOPATA - MADRE DE DIOS",ACTIVO,PROYECTO DE INVERSION,SI,OPMI DEL GOBIERNO REGIONAL MADRE DE DIOS,AREA FUNCIONAL DE ESTUDIOS Y PROYECTOS - SEDE CENTRAL GOREMAD,UEI  GOBIERNO REGIONAL MADRE DE DIOS-SEDE CENTRAL,VIABLE,NO,SANEAMIENTO - SANEAMIENTO - SANEAMIENTO RURAL,03/02/2016,"1,817,389.00",216,SI,SI,20/06/2019,20/08/2022,"1,346,507.98",0.00,0.00,"1,346,507.98","1,346,507.98","127,900.00",9.5 %,"1,218,607.98",JUL-2017,DIC-2017,,"1SERVICIO DE CONSULTORIA PARA LA ELABORACIÓN DE EXPEDIENTE TECNICO DEL PIP  MEJORAMIENTO  Y AMPLIACIÓN DEL SISTEMA DE AGUA POTABLE Y SANEAMEINTO BASICO EN EL CP. DE LAS MERCEDES DEL DIST. DE LABERINTO   TAMBOPATA.PAULLO SOTELO JOSE ANTONIOCONTRATO No. 12-2017-GOREMAD-GGR17/04/2017107,100.00107,100.00",,
2304176,343080,14/12/2015,"RECUPERACION DE SUELOS DEFORESTADOS PARA MEJORAR LA PRODUCCION DE CACAO EN 25 SECTORES DE LA PROVINCIA DE TAMBOPATA Y 18 SECTORES DE LA PROVINCIA DE TAHUAMANU, REGION MADRE DE DIOS",ACTIVO,PROYECTO DE INVERSION,SI,OPMI DEL GOBIERNO REGIONAL MADRE DE DIOS,UF DIRECCIÓN REGIONAL DE AGRICULTURA,UEI DIRECCION REGIONAL DE AGRICULTURA,VIABLE,NO,"PLANEAMIENTO, GESTIÓN Y RESERVA DE CONTINGENCIA - CIENCIA Y TECNOLOGÍA - INNOVACIÓN TECNOLÓGICA",30/12/2015,"18,786,906.00","10,000",SI,SI,01/07/2019,30/11/2023,"18,508,762.15",0.00,0.00,"18,508,762.15","18,508,762.15","10,421,104.28",56.3 %,"8,087,657.86",OCT-2016,DIC-2021,,,"1ADQUISICIÓN DE BOLSAS DE REPIQUE DE POLIETILENO PARA EL PROYECTO ¿RECUPERACIÓN DE SUELOS DEFORESTADOS PARA MEJORAR LA PRODUCCIÓN DE CACAO EN 25 SECTORES DE LA PROVINCIA DE TAMBOPATA Y 18 SECTORES DE LA PROVINCIA DE TAHUAMANU¿GRUPO DE EMPRESA SPP S.A.CONTRATO N°005-2021-GOREMAD-GRDE/DRA.20/07/202158,017.0058,017.001Adquisición de Combustible¿ para el proyecto ¿RECUPERACION DE SUELOS DEFORESTADOS PARA MEJORAR LA PRODUCCION DE CACAO EN 25 SECTORES DE LA PROVINCIA TAMBOPATA Y 18 SECTORES DE LA PROVINCIA DE TAHUAMANU ¿ MADRE DE DIOSW-LEO REPRESENTACIONES S.R.L.CONTRATO N°003-2021-GOREMAD-GRDE-DRA14/06/202196,379.0096,379.001ADQUISICIÓN DE MADERA DIVERSAS PARA EL PROYECTO ¿RECUPERACIÓN DE SUELOS DEFORESTADOS PARA MEJORAR LA PRODUCCIÓN DE CACAO EN 25 SECTORES DE LA PROVINCIA DE TAMBOPATA Y 18 SECTORES DE LA PROVINCIA DE TAHUAMANU""ATAUSINCHI YUCRA OMAIRACONTRATO N°002-2021-GOREMAD-GRDE-DRA31/05/202151,682.0051,682.001TIERRA NEGRA FRANCO LIMOSOCOMERCIALIZADORA EL YUYO EMPRESA INDIVIDUAL DE RESPONSABILIDAD LIMITADA3720/07/202062,125.0062,125.001ADQUISICION DE 32 MOTOCICLETAS PARA EL PROYECTO: RECUPERACION DE LOS SUELOS DEFORESTADOS PARA MEJORAR LA PRODUCCION DEL CACAO EN 25 SECTORES DE LA PROVINCIA TAMBOPATA Y 18 SECTORES DE LA PROVINCIA DE TAHUAMANU - MADRE DE DIOS.  META-024.REPRESENTACIONES YAMAMOTOR EMPRESA INDIVIDUAL DE RESPONSABILIDAD LIMITADA001-2020-GOREMAD-GRDE/DRA09/01/2020262,400.00262,400.001ADQUISICION TUBETES DE POLIPROPILENO PARA EL PROYECTO: RECUPERACION DE LOS SUELOS DEFORESTADOS PARA MEJORAR LA PRODUCCION DEL CACAO EN 25 SECTORES DE LA PROVINCIA TAMBOPATA Y 18 SECTORES DE LA PROVINCIA DE TAHUAMANU - MADRE DE DIOS.TOVAR ACUNA YAQUELIN002-2020-GOREMAD-GRDE/DRA28/01/2020210,000.00210,000.001ADQUISICION DE MADERA, PARA EL PROYECTO: RECUPERACION DE LOS SUELOS DEFORESTADOS PARA MEJORAR LA PRODUCCION DEL CACAO EN 25 SECTORES DE LA PROVINCIA TAMBOPATA Y 18 SECTORES DE LA PROVINCIA DE TAHUAMANU - MADRE DE DIOS.CONSORCIO INVERSIONES DJ EL CARIBE SAC Y INVERSIONES CORPORATIVAS JODAV ERIRL002-2019-GOREMAD-GRDE/DRA30/12/2019219,857.00219,857.001ADQUISICION DE 02 CAMIONETAS PARA EL PROYECTO: RECUPERACION DE LOS SUELOS DEFORESTADOS PARA MEJORAR LA PRODUCCION DEL CACAO EN 25 SECTORES DE LA PROVINCIA TAMBOPATA Y 18 SECTORES DE LA PROVINCIA DE TAHUAMANU - MADRE DE DIOS.  META-024.ROKA TRAVEL - CAAN001-2019/GOREMAD-GRDE/DRA-AS116/12/2019373,980.00373,980.00",
2306939,345644,08/01/2016,"MEJORAMIENTO DE LOS SERVICIOS DE EDUCACIÓN INICIAL DE LAS I.E. N 279 NIÑO DE PRAGA, N 326 PALOTOA, N 303 SHINTUYA, N 350 ITAHUANIA, N 375 DE GAMITANA, N 390 DE PANTIACOLLA DE LOS CENTROS POBLADOS DE SALVACION, PALOTO,LLACTAPAMPA, SHINTUYA, ITAHUANIA, ASUNCION DE GAMITANA Y PANTIACOLLA, DEL DISTRITO DEL MANU, PROVINCIA DE MANU - MADRE DE DIOS",DESACTIVADO PERMANENTE,PROYECTO DE INVERSION,NO,OPMI DE LA MUNICIPALIDAD PROVINCIAL DE MANU,UF DE LA MUNICIPALIDAD PROVINCIAL DE MANU,UEI DE LA MUNICIPALIDAD PROVINCIAL DE MANU,VIABLE,NO,EDUCACIÓN - EDUCACIÓN BÁSICA - EDUCACIÓN INICIAL,27/03/2017,"12,731,544.00","1,245",NO,NO,,,"12,731,544.00",0.00,0.00,"12,731,544.00","12,731,544.00",0.00,0 %,"12,731,544.00",,,,,,
