codigo_unico,snip,fecha_registro,nombre_inversion,estado,tipo_inversion,programa_pmi,ompi,uf,uei,situacion,decreto_emergencia,cadena_funcional,viabilidad_aprobacion,costo_aprobado,beneficiarios,expediente_tecnico,reg_seguimiento,inicio_ejecucion,fin_ejecucion,inversion_actualizado,sol_controversias,carta_fianza,inver_total,costo_inversion,devengado_acumulado,avance_financiero_acum,saldo,fecha_primerdevengado,fecha_ultimodevengado,seaceobra,seaceconsul,seacebien,seaceserv
2183612,171096,16/12/2010,AMPLIACION Y MEJORAMIENTO DEL SERVICIO EDUCATIVO DE LA IEBR HORACIO ZEVALLOS GAMES - HUAYPETUHE - PROVINCIA DEL MANU - REGION MADRE DE DIOS.,ACTIVO,PROYECTO DE INVERSION,NO,OPMI DEL GOBIERNO REGIONAL MADRE DE DIOS,AREA FUNCIONAL DE ESTUDIOS Y PROYECTOS - SEDE CENTRAL GOREMAD,UEI  GOBIERNO REGIONAL MADRE DE DIOS-SEDE CENTRAL,VIABLE,NO,EDUCACIÓN - EDUCACIÓN BÁSICA - EDUCACIÓN SECUNDARIA,11/04/2013,"9,169,307.00","11,548",SI,SI,01/04/2015,30/01/2022,"19,200,177.04",0.00,0.00,"19,200,177.04","19,200,177.04","19,194,010.7",100 %,"6,166.33",ABR-2015,ENE-2021,,,"1ADQUISICION DE MOBILIARIO ESCOLAR PARA NIVEL PRIMARIOG Y G CONTRATISTAS SRL63-2018-GOREMAD/GGR11/09/2018387,000.00387,000.001ADQUISICION DE 15,000 BOLSAS DE CEMENTO PORTLAND PUZOLANICO TIPO IP X 42.50KG, OBRA: ""AMPLIACION Y MEJORAMIENTO DEL SERVICIO EDUCATIVO DE LA I.E.B.R. Nº 52082 HORACIO ZEVALLOS GAMES, DISTRITO DE HUEPETUHE, PROVINCIA DE MANU, REGION MADRE DE DIOS"".CODECO E.I.R.L45-2018-GOREMAD/GGR15/08/2018401,850.00401,850.001ADQUISICION DE 25,000 UNIDADES DE LADRILLO DE ARCILLA DE 9X13X24CM DE 18 HUECOS., OBRA: ""AMPLIACION Y MEJORAMIENTO DEL SERVICIO EDUCATIVO DE LA I.E.B.R. HORACIO ZEVALLOS GAMES - DISTRITO DE HUEPETUHE-PROVINCIA DE MANU- REGION MADRE DE DIOS"" META - 14GRUPO SERRANO QUINTANILLA SOCIEDAD COMERCIAL DE RESPONSABILIDAD LIMITADA-GRUPO SQ S.R.L.137331/07/201843,750.0043,750.001ADQUISICION DE PUERTAS DE MADERA TORNILLO (INCLUYE INSTALACION Y PUESTA EN FUNCIONAMIENTO), OBRA: ""AMPLIACION Y MEJORAMIENTO DEL SERVICIO EDUCATIVO DE LA I.E.B.R. HORACIO ZEVALLOS GAMES - DISTRITO DE HUEPETUHE-PROVINCIA DE MANU- REGION MADRE DE DIOS""CONSORCIO ALBA129820/07/201879,500.0079,500.001ADQUISICION DE PINTURAS, OBRA: ""AMPLIACION Y MEJORAMIENTO DEL SERVICIO EDUCATIVO DE LA I.E.B.R. HORACIO ZEVALLOS GAMES - DISTRITO DE HUEPETUHE-PROVINCIA DE MANU- REGION MADRE DE DIOS"" META - 14PROVEEDORA MULTISERVICIOS DJ CUSCO S.R.L.89121/05/201859,705.0059,705.001LUMINIARIA PARA INSTALACIONES ELECTRICASELECTRO VILCANOTA S.A.C.93429/05/201838,997.0038,997.001ADQUISICION DE CONDUCTORES ELECTRICOS, OBRA: ""AMPLIACION Y MEJORAMIENTO DEL SERVICIO EDUCATIVO DE LA I.E.B.R. HORACIO ZEVALLOS GAMES - DISTRITO DE HUEPETUHE-PROVINCIA DE MANU- REGION MADRE DE DIOS"" META - 14CONSORCIO COMERCIALIZADORA PRODUCTOS ELECTRICOS SOCIEDAD COMERCIAL DE RESPONSABILIDAD LIMITADA92524/05/201865,213.0065,213.001ADQUISICION DE VARILLAS DE ACERO CORRUGADO GRADO 60  DE DIFERENTES MEDIDAS, PARA LA OBRA: ¿AMPLIACION Y MEJORAMIENTO DEL SERVICIO EDUCATIVO DE LA I.E.B.R. Nº 52082 HORACIO ZEVALLOS GAMES, DISTRITO DE HUEPETUHE ¿ PROVINCIA DE MANU ¿ REGIÒN DE MADRE DECOMERCIALIZADORA GRUPO SANTA FE SOCIEDAD ANONIMA CERRADA - COMERCIALIZADORA GRUPO SANTA FE S.A.C.016-2018-GOREMAD/GGR19/04/2018143,855.00143,855.001ADQUISICION DE MATERIAL AGREGADO, OBRA: ""AMPLIACION Y MEJORAMIENTO DEL SERVICIO EDUCATIVO DE LA I.E.B.R. HORACIO ZEVALLOS GAMES - DISTRITO DE HUEPETUHE-PROVINCIA DE MANU- REGION MADRE DE DIOS"" META - 14MINERA TRANSOCEANICA SOCIEDAD ANONIMA CERRADA63313/04/201861,490.0061,490.001ADQUISICION DE CEMENTO PORTLAND TIPO IP X 42.5 KG. PARA LA OBRA AMPLIACION Y MEJORAMIENTO DEL SERVICIO EDUCATIVO DE LA I.E.B.R. HORACION ZEVALLOS GAMES HUEPETUE, PROVINCIA DE MANU, REGION MADRE DE DIOSCODECO E.I.R.L010-2018-GOREMAD/GGR22/03/2018357,618.00357,618.001ADQUISICIÓN DE 105,000 UNIDADES DE LADRILLO DE ARCILLA 9X13X24CM DE 18 HUECOS PARA LA OBRA AMPLIACION Y MEJORAMIENTO DEL SERVICIO EDUCATIVO DE LA I.E.B.R. HORACIO ZEBALLOS GAMES, HUAYPETUE PROVINCIA DE MANU- REGIÓN DE MADRE DE DIOS, META 018.CONSORCIO SAN MARTIN- GRUPO SERRANO QUINTANILLA S.R.L.- CONIDEP S.A.C72-2017-GOREMAD/ORA21/12/2017225,750.00225,750.001ADQUISICION DE CEMENTO PORTLAND TIPO IP 42.50 KG. PARA LA OBRA AMPLIACION Y MEJORAMIENTO DEL SERVICIO EDUCATIVO DE LA I.E.B.R. HORACIO ZEBALLOS GAMES, HUAYPETUE PROVINCIA DE MANUFERRETERIA INTEROCEANICA EMPRESA INDIVIDUAL DE RESPONSABILIDAD LIMITADA  - FERRETERIA INTEROCEANICA064-2017-GOREMAD/GGR28/11/2017290,000.00290,000.001ADQUISICION DE ACERO DE REFUERZO CORRUGADO  FY=4200 GRADO 60 PARA LA OBRA AMPLIACION Y MEJORAMIENTO DEL SERVICIO EDUCATIVO DE LA I.E.B.R. HORACIO ZEBALLOS GAMES, HUAYPETUE PROVINCIA DE MANUCOMERCIAL ARIANA EMPRESA INDIVIDUAL DE RESPONSABILIDAD LIMITADA061-2017-GOREMAD/GGR22/11/2017336,000.00336,000.00","1SERVICIO DE SUMINISTRO E INSTALACION DE VENTANAS DE ALUMINIO Y VIDRIO TEMPLADO DE 6MMCORPORACION TECSER SOCIEDAD ANONIMA CERRADA - CORPORACION TECSER S.A.C.9229/11/2018235,000.00235,000.001SUMINISTRO E INSTALACION DE FALSO CIELO RASO EN PVCCORPORACION TECSER SOCIEDAD ANONIMA CERRADA - CORPORACION TECSER S.A.C.8714/11/2018176,500.00176,500.001SERVICIOS DE SUMINISTRO, FABRICACION E INSTALACION DE ESTRUCTURA METALICA Y COBERTURA CON PLANCHA METALICA ASTM A792 AZ-150 (SEGÚN DISEÑO) INCLUYE MATERIAL A TODO COSCTO PARA LA OBRA MEJORAMIENTO DEL SISTEMA EDUCATIVO DE LA I.E.B.R. N 52229 DANIEL ASCONSORCIO DORADO EMSOLUTIONS SAC RENOVACIONES JJL EIRL81-2018-GOREMAD/GGR23/10/2018399,000.00399,000.001SERVICIO E INSTALACION DE VENTANAS DE ALUMINIO CON VIDRIO TEMPLADO DE 6MM CON LAMINA DE SEGURIDAD, OBRA: ""AMPLIACION Y MEJORAMIENTO DEL SERVICIO EDUCATIVO DE LA I.E.B.R. HORACIO ZEVALLOS GAMES - DISTRITO DE HUEPETUHE-PROVINCIA DE MANU- REGION MADRE DREPRESENTACIONES V Y L EMPRESA INDIVIDUAL DE  RESPONSABILIDAD LIMITADA-REPRESENTACIONES V Y L E.I.R.62-2018-GOREMAD/GGR10/09/2018158,000.00158,000.001SERVICIO DE SUMINISTRO, FABRICACION E INSTALACION METALICA EN COBERTURA DE POLIDEPORTIVO PARA LA OBRA AMPLIACION Y MEJORAMIENTO DEL SERVICIO EDUCATIVO DE LA I.E.B.R. HORACION ZEVALLOS GAMES HUEPETUE, PROVINCIA DE MANU, REGION MADRE DE DIOSCONSORCIO TAMBOPATA58-2018-GOREMAD/GGR06/09/20180.00232,854.001SERVICIO DE SUMINISTRO, INSTALACION Y PUESTA EN FUNCIONAMIENTO A TODO COSTO DE LA SUBESTACION DE DISTRIBUCION 150 KVA 22.9/0.38 0.22 kv (CORRIENTE), OBRA: ""AMPLIACION Y MEJORAMIENTO DEL SERVICIO EDUCATIVO DE LA I.E.B.R. HORACIO ZEVALLOS GAMES - DISTRITO DE HUEPETUHE-PROVINCIA DE MANU- REGION MADRE DE DIOS""INGENIERIA NEGOCIOS Y SERVICIOS MULTIPLES ALPHO EMPRESA INDIVIDUAL DE RESPONSABILIDAD LIMITADA52-2018-GOREMAD/GGR21/08/2018116,244.00116,244.00"
2183613,147322,18/03/2010,"AMPLIACION Y MEJORAMIENTO DEL SERVICIO EDUCATIVO EN LA I.E.B.R. N 52166 NUESTRA SEÑORA DE FATIMA DEL AA.HH. BARRIO NUEVO EN LA CIUDAD DE PUERTO MALDONADO, DISTRITO Y PROVINCIA DE TAMBOPATA, DEPARTAMENTO MADRE DE DIOS.",ACTIVO,PROYECTO DE INVERSION,NO,OPMI DEL GOBIERNO REGIONAL MADRE DE DIOS,AREA FUNCIONAL DE ESTUDIOS Y PROYECTOS - SEDE CENTRAL GOREMAD,UEI  GOBIERNO REGIONAL MADRE DE DIOS-SEDE CENTRAL,VIABLE,NO,EDUCACIÓN - EDUCACIÓN BÁSICA - EDUCACIÓN PRIMARIA,09/07/2013,"4,539,760.00","2,364",SI,SI,24/03/2016,30/01/2022,"5,358,325.02",0.00,"1,318,113.77","6,676,438.78","6,676,438.78","6,611,102.87",99 %,"65,335.91",MAR-2014,NOV-2020,"1EJECUCION DE OBRA - AMP. Y MEJORAMIENTO DE LA I.E. NUESTRA SEÑORA DE FATIMA - AA.HH. BARRIO NUEVOCONSORCIO FATIMA008-2016/GOREMAD/GR26/02/20164,254,861.004,254,861.00","1CONTRATACION DE SERVICIO DE CONSULTORIA DE OBRAS PARA OBRA: AMPLIACION Y MEJ. IEBR NUESTRA SRA. FATIMAVACCARO ALVAREZ ANGEL GUIDO010-2016-GOREMAD/GGR07/03/2016258,209.00258,209.00","1ADQUISICION DE MOBILIARIO ESCOLAR DE MADERA TORNILLO, para la Obra: ¿AMPLIACION Y MEJORAMIENTO DEL SERVICIO EDUCATIVO EN LA I.E.B.R. N 52166 NUESTRA SEÑORA DE FATIMA DEL AA.HH. BARRIO NUEVO EN LA CIUDAD DE PUERTO MALDONADO, DISTRITO Y PROVINCIA DE TACONSORCIO TELKA8916/11/2018138,000.00138,000.001CEMENTO PORTLAND PUZOLANICO TIPO IP X 42.50 kgZAMORA CORPORATION S.R.L.186924/09/201833,060.0033,060.001ADQUISICION DE VARILLA DE ACERO CORRUGADO FY= 4200KG/CM2 GRADO 60COMERCIALIZADORA GRUPO SANTA FE SOCIEDAD ANONIMA CERRADA - COMERCIALIZADORA GRUPO SANTA FE S.A.C.74430/04/201832,009.0032,009.001ADQUISICION DE CEMENTO PORTLAND TIPO IP X 42.50 KG. PARA LA OBRA AMPLIACION Y MEJORAMIENTO DEL SERVICIO EDUCATIVO EN LA I.E.B.R. N 52166 NUESTRA SEÑORA DE FATIMA DEL AA.HH. BARRIO NUEVO EN LA CIUDAD DE PUERTO MALDONADO PROVINCIA Y DISTRITO DE TAMBOPATA REGION MADRE DE DIOSCODECO E.I.R.L011-2018-GOREMAD/GGR22/03/201865,212.0065,212.00","1SERVICIO DE SUMNINISTRO, FABRICACION E INSTALACION DE ESTRUCTURAS  METALICA Y COBERTURA PARA LA OBRA  AMPLIACION Y MEJORAMIENTO DEL SERVICIO EDUCATIVO EN LA I.E.B.R. N 52166 NUESTRA SEÑORA DE FATIMA DEL AA.HH. BARRIO NUEVO EN LA CIUDAD DE PUERTO MADEJ INGENIEROS CONTRATISTAS  S.A.C. - ADEJ S.A.C.77-2018-GOREMAD/GGR18/10/2018195,000.00195,000.001SERVICIO DE SUMINISTRO, FABRICACIÓN E INSTALACIÓN DE ESTRUCTURA DE MADERA (TIJERALES) Y COBERTURA  PARA LA OBRA AMPLIACION Y MEJORAMIENTO DEL SERVICIO EDUCATIVO EN LA I.E.B.R. N 52166 NUESTRA SEÑORA DE FATIMA DEL AA.HH. BARRIO NUEVO EN LA CIUDAD DE SSIN FRONTERAS CONSULTORES & EJECUTORES S.A.C.48-2018-GOREMAD/GGR20/08/2018120,000.00120,000.00"
2186501,236286,16/10/2012,"REHABILITACION Y MEJORAMIENTO DEL CAMINO VECINAL EL TRIUNFO - COMUNIDAD BAJO MADRE DE DIOS , DISTRITO DE LAS PIEDRAS - TAMBOPATA - MADRE DE DIOS",CERRADO,PROYECTO DE INVERSION,NO,OPMI DEL GOBIERNO REGIONAL MADRE DE DIOS,UF PROYECTO ESPECIAL MADRE DE DIOS,proyecto especial madre de dios,VIABLE,NO,TRANSPORTE - TRANSPORTE TERRESTRE - VÍAS VECINALES,08/08/2013,"3,722,896.00","2,284",SI,SI,18/04/2016,12/07/2018,"4,614,748.51",0.00,0.00,"4,614,748.51","4,614,748.51","4,365,030.19",94.6 %,"249,718.31",DIC-2013,ABR-2019,,,"1DIESEL B5 S50SERVICENTRO CARIBE S.A.C.CONTRATO N° 017-201716/08/201793,000.0093,000.001ADQUISICION DE COMBUSTLE DIESEL B5-50SERVICENTRO CARIBE S.A.C.19-2016-GOREMAD-PEMD-210020/09/2016168,300.00168,300.001ADQUISICION DE LLANTAS PARA MAQUINARIA PESADA  LIBIANAMC LLANTAS DEL SUR EMPRESA INDIVIDUAL DE RESPONSABILIDAD LIMITADA - MC LLANTAS DEL SUR E.I.R.L.013-201619/08/201654,700.0054,700.001ADQUISICION DE REPUESTOS PARA VOLQUETE ASIGNADO A OBRAAUTOMOTORES K & L SAC15-2016-GOREMAD-PEMD-210029/08/201648,895.0048,895.001ADQUISICION DE ACEITE LUBRICANTE PARA MANTENIMIENTO PREVENTIVO DE LA OBRA: rEHABILITACION Y MEJORMAIENTO DEL CAMINO VECINAL EL TRIUNFO - COMUNIDAD BAJO MADRE DE DIOS.TODO REPUESTOS Y SERVICIOS S.A.C. - TORESER S.A.C.318-201622/07/201639,747.0039,747.001ADQUISICION DE REPUESTOS PARA RODILLO LISO DINAPAC CA25II AÑO 1995DISTRIBUIDORA LUBAMA S.A.C275-201612/07/201639,290.0039,290.001ALCANTARILLA DE 24EDUARDO RIOS Y ASOCIADOS S.A.C00704/07/2016188,030.00188,030.001VIVERES PARA PERSONALCUTIPA NAOLA DOLORES006-201627/06/2016103,999.00103,999.001CEMENTOZAMORA CORPORATION S.R.L.255-201623/06/201691,800.0091,800.001BARRA PARA CONSTRUCCION DE 1/2 in GRADO 60L & P INGROUP S.A.C.256-201623/06/201637,425.0037,425.00","1SERVICIO DE ALQUILER DE VOLQUETE DE 15M3 A TODO COSTOCONSTRUCTORA E INVERSIONES A & R MADRE DE DIOS S.A.C.14-2016-GOREMAD-PEMD-210016/08/2016263,600.00114,800.002SERVICIO DE ALQUILER DE MOTONIVELADORA A TODO COSTOCONSTRUCTORA E INVERSIONES A & R MADRE DE DIOS S.A.C.14-2016-GOREMAD-PEMD-210016/08/2016263,600.00148,800.001SERVICIO DE INTERNET PARA LA SEDE CENTRALNETWORKING SAT E.I.R.L004-2016-GOREMAD-PEMD-210008/06/201637,613.0037,613.00"
2191142,243236,05/12/2012,"MEJORAMIENTO DE LOS SERVICIOS EDUCATIVOS DE LA IEI. N 366 NUEVA AREQUIPA DISTRITO DE INAMBARI, PROVINCIA DE TAMBOPATA, REGION MADRE DE DIOS",ACTIVO,PROYECTO DE INVERSION,SI,OPMI DEL GOBIERNO REGIONAL MADRE DE DIOS,DIRECCIÓN REGIONAL DE EDUCACION,UEI GOBIERNO REGIONAL MADRE DE DIOS-SEDE CENTRAL,VIABLE,NO,EDUCACIÓN - EDUCACIÓN BÁSICA - EDUCACIÓN INICIAL,19/12/2013,"934,375.00",776,SI,NO,01/10/2014,27/09/2019,"1,237,721.44","86,579.00",0.00,"1,324,300.44","1,324,300.44","1,220,486.51",92.2 %,"103,813.92",MAY-2014,DIC-2019,"1OBRA: MEJORAMIENTO DE LOS SERVICIOS EDUCATIVOS DE LA I.E.E N°366 NUEVA AREQUIPA-INAMBARICONSORCIO NUEVA AREQUIPA15431/12/20141,032,085.001,032,085.00","1SERVICIO DE SUPERVISIàN DE OBRA MEJ. DE SERV. EDUCATIVOS I.E. N 366 NUEVA AREQUIPA-INAMBARIWALTER MEJIA GALICIA/CORDOVA FLOREZ GILMAR15931/12/201451,000.0051,000.00",,
2191378,268990,26/07/2013,MEJORAMIENTO DE LA CAPACIDAD COMPETITIVA DE LOS APICULTORES ARTICULADO A LA AGRICULTURA Y USO DE BOSQUES EN LA PROVINCIA DE TAMBOPATA  - MADRE DE DIOS,ACTIVO,PROYECTO DE INVERSION,SI,OPMI DEL GOBIERNO REGIONAL MADRE DE DIOS,UF PROYECTO ESPECIAL MADRE DE DIOS,proyecto especial madre de dios,VIABLE,NO,"PLANEAMIENTO, GESTIÓN Y RESERVA DE CONTINGENCIA - CIENCIA Y TECNOLOGÍA - INNOVACIÓN TECNOLÓGICA",28/01/2014,"1,985,666.00",300,SI,SI,01/04/2019,31/05/2022,"3,432,865.94",0.00,0.00,"3,432,865.94","3,432,865.94","2,502,696.57",72.9 %,"930,169.37",JUN-2014,FEB-2022,,,"1ADQUISICIÓN DE COLMENA ESTÁNDAR CON PIQUERA, PARA EJECUCIÓN DEL PROYECTO: ""MEJORAMIENTO DE LA CAPACIDAD COMPETITIVA DE LOS APICULTORES A LA AGRICULTURA Y USO DE BOSQUES EN LA PROVINCIA DE TAMBOPATA, REGIÓN MADRE DE DIOS"".ECOLSPERU EMPRESA INDIVIDUAL DE RESPONSABILIDAD LIMITADA - ECOLSPERU E.I.R.LCONTRATO N°010-2020-GOREMAD-PEMD-210017/11/2020125,490.00125,490.001ADQUISICION DE NUCLEOS DE ABEJA, PARA EL PROYECTO: ""MEJORAMIENTO DE LA CAPACIDAD COMPETITIVA DE LOS APICULTORES ARTICULADO A LA AGRICULTURA Y USO DE BOSQUES EN LA PROVINCIA DE TAMBOPATA - REGION MADRE DE DIOS"".CORPORACION ANDINA BAVIL SOCIEDAD ANONIMA CERRADA - BAVIL S.A.C.CONTRATO N°004-2020-GOREMAD-PEMD-210019/10/2020185,640.00185,640.00",
2191717,278483,26/11/2013,MEJORAMIENTO DE LA CAPACIDAD DE COMUNICACION Y MONITOREO PARA LAS ACCIONES DE DEFENSA CIVIL Y SEGURIDAD DEL CENTRO DE OPERACIONES DE EMERGENCIAS REGIONALES DEL GOBIERNO REGIONAL DE MADRE DE DIOS,ACTIVO,PROYECTO DE INVERSION,SI,OPMI DEL GOBIERNO REGIONAL MADRE DE DIOS,AREA FUNCIONAL DE ESTUDIOS Y PROYECTOS - SEDE CENTRAL GOREMAD,UEI  GOBIERNO REGIONAL MADRE DE DIOS-SEDE CENTRAL,VIABLE,NO,ORDEN PÚBLICO Y SEGURIDAD - GESTIÓN DE RIESGOS Y EMERGENCIAS - PREVENCIÓN DE DESASTRES,08/01/2014,"9,997,497.00","130,876",SI,SI,01/08/2016,25/01/2019,"10,292,015.17","340,366.07",0.00,"10,632,381.24","10,632,381.24","10,292,015.17",96.8 %,"340,366.07",SET-2014,OCT-2019,"1EJECUCIÓN DE OBRA DEL PROYECTO MEJORAMIENTO DE LA CAPACIDAD DE COMUNICACION Y MONITOREO PARA LAS ACCIONES DE DEFENSA CIVIL Y SEGURIDAD DEL CENTRO DE OPERACIONES DE EMERGENCIAS REGIONALES DEL GOBIERNO REGIONAL DE MADRE DE DIOSMATEC INGENIEROS SOC. DE R.LTDA.019-2017-GOREMAD/GGR09/05/20171,327,256.002,087,347.00",,"1ADQUISICION DE BIENES DE TELECOMUNICACION PARA EL SISTEMA DE VIDEO INCLUIDO SU INSTALACION.INTELECO9126/11/2018133,240.00133,240.001ADQUISICION DE EQUIPOS DE TELECOMUNICACION SUMINISTRO INSTALACION Y PUESTA EN FUNCIONAMIENTO PARA EL PROYECTO MEJORAMIENTO DE LA CAPACIDAD DE COMUNICACIàN Y MONITOREO PARA LAS ACCIONES DE DEFENSA CIVIL Y SEGURIDAD DEL CENTRO DE OPERACIONES DE EMERGENCONSORCIO SEPURA - GOREMADCONTRATO Nro. 005-2017-GOREMAD/GGR02/02/20177,190,578.007,190,578.00",
2192356,290594,20/03/2014,"MEJORAMIENTO VIAL Y DRENAJE PLUVIAL DEL JIRON JAIME TRONCOSO DE LA CIUDAD DE PUERTO MALDONADO , PROVINCIA DE TAMBOPATA - MADRE DE DIOS",ACTIVO,PROYECTO DE INVERSION,NO,OPMI DEL GOBIERNO REGIONAL MADRE DE DIOS,AREA FUNCIONAL DE ESTUDIOS Y PROYECTOS - SEDE CENTRAL GOREMAD,UEI  GOBIERNO REGIONAL MADRE DE DIOS-SEDE CENTRAL,VIABLE,NO,TRANSPORTE - TRANSPORTE URBANO - VÍAS URBANAS,03/04/2014,"9,565,766.00","2,916",SI,SI,01/04/2014,30/06/2022,"12,850,690.81",0.00,0.00,"12,850,690.81","12,850,690.81","11,598,821.88",90.3 %,"1,251,868.92",ABR-2014,JUL-2021,,,"1CEMENTO PORTLAND PUZOLANICO TIPO IP X 42.50 kgGRUPO SANTA FE SOCIEDAD ANONIMA CERRADA - GRUPO SANTA FE S.A.C.08-2020-GOREMAD/GGR09/03/2020111,500.00111,500.001VARILLAS DE ACERO CORRUGADOCOMERCIAL ARIANA EMPRESA INDIVIDUAL DE RESPONSABILIDAD LIMITADA30521/02/202079,500.0079,500.001ADQUISICION DE FIBRA DE ACERO PARA REFUERZO DE CONCRETO, PARA LA OBRA: ""MEJORAMIENTO VIAL Y DRENAJE PLUVIAL DEL JR. JAIME TRONCOSO DE LA CIUDAD DE PUERTO MALDONADO, DISTRITO Y PROVINCIA DE TAMBOPATA, REGION MADRE DE DIOS""COMERCIAL ARIANA EMPRESA INDIVIDUAL DE RESPONSABILIDAD LIMITADA30621/02/202042,250.0042,250.001ARENA GRUESAK.T. CONTRATISTAS GENERALES S.R.L.6328/10/2019363,945.0047,925.002AGREGADO GRUESO 3/4 IN PARA CONCRETOK.T. CONTRATISTAS GENERALES S.R.L.6328/10/2019363,945.00133,020.003MATERIAL GRANULAR PARA SUB BASE TIPO BK.T. CONTRATISTAS GENERALES S.R.L.6328/10/2019363,945.00183,000.001ADQUISICIÓN FIBRA DE ACERO DE ALTA RESISTENCIA,  PARA LA OBRA: MEJORAMIENTO  VIAL Y DRENAJE PLUVIAL JR. JAIME TRONCOSO DE LA CIUDAD DE PUERTO MALDONADO, PROVINCIA DE TAMBOPATA - MADRE DE DIOSINGENIEROS MANEJANDO RECURSO HIDRICO Y MEDIO AMBIENTE SOCIEDAD ANONIMA CERRADA19-2019-GOREMAD/GGR17/06/2019162,000.00162,000.001PETROLEO DIESEL,  PARA LA OBRA: MEJORAMIENTO  VIAL Y DRENAJE PLUVIAL JR. JAIME TRONCOSO DE LA CIUDAD DE PUERTO MALDONADO, PROVINCIA DE TAMBOPATA - MADRE DE DIOSINVERSIONES GASOIL EMPRESA INDIVIDUAL DE RESPONSABILIDAD LIMITADA - INVERSIONES GASOIL E.I.R.L.76028/05/201965,340.0065,340.001ADQUISICION DE AGREGADO Y ARENA,  PARA LA OBRA: ¿MEJORAMIENTO VIAL Y DRENAJE PLUVIAL DEL JR. JAIME TRONCOSO  DE LA CIUDAD DE PUERTO MALDONADO, PROVINCIA DE TAMBOPATA . MADRE DE DIOS¿  META: 064.INVERSIONES M.D.F.E. EMPRESA INDIVIDUAL DE RESPONSABILIDAD LIMITADA18-2019-GOREMAD/GGR04/06/2019275,790.00275,790.001ADQUISICION DE VARILLA DE ACERO CORRUGADO FY=4200 KG/CM GRADO 60 DE DIFERENTES MEDIDAS PARA LA OBRA ¿MEJORAMIENTO VIAL Y DRENAJE PLUVIAL DEL JR. JAIME TRONCOSO DE LA CIUDAD DE PUERTO MALDONADO, PROVINCIA DE TAMBOPATA- REGION MADRE DE DIOSCOMERCIALIZADORA GRUPO SANTA FE SOCIEDAD ANONIMA CERRADA - COMERCIALIZADORA GRUPO SANTA FE S.A.C.10-201907/05/201994,877.0094,877.001CEMENTO PORTLAND TIPO IP (42.5 KG),  PARA LA OBRA: MEJORAMIENTO  VIAL Y DRENAJE PLUVIAL JR. JAIME TRONCOSO DE LA CIUDAD DE PUERTO MALDONADO, PROVINCIA DE TAMBOPATA - MADRE DE DIOSFERRETERIA JHON EMPRESA INDIVIDUAL DE RESPONSABILIDAD LIMITADA - FERRETERIA JHON E.I.R.L.07-2019-GOREMAD/GGR26/04/2019614,460.00614,460.001MATERIAL GRANULAR PARA SUB BASE TIPO ACONSTRUCCIONES MANTENIMIENTO Y SERVICIOS ARIES E.I.R.L.271121/12/201874,550.0074,550.001CEMENTO PORTLAND PUZOLANICO TIPO IP X 42.50 kgFERRETERIA INTEROCEANICA EMPRESA INDIVIDUAL DE RESPONSABILIDAD LIMITADA  - FERRETERIA INTEROCEANICA10117/12/2018340,200.00340,200.001FIBRA DE ACERO DE ALTA RESISTENCIACOMERCIAL ARIANA EMPRESA INDIVIDUAL DE RESPONSABILIDAD LIMITADA10017/12/2018112,655.00112,655.001PIEDRA ZARANDEADA DE 3/4 inPAMARA INVERSIONES S.A.C.264818/12/201875,000.0045,874.002ARENA GRUESAPAMARA INVERSIONES S.A.C.264818/12/201875,000.0029,126.001ADQUISICION DE CEMENTO PORTLAND TIPO IP 42.50 KG. PARA LA OBRA MEJORAMIENTO VIAL Y DRENAJE PLUVIAL DEL JIRON JAIME TRONCOSO DE LA CIUDAD DE PUERTO MALDONADO - PROVINCIA DE TAMBOPATA, REGION MADRE DE DIOSFERRETERIA JHON EMPRESA INDIVIDUAL DE RESPONSABILIDAD LIMITADA - FERRETERIA JHON E.I.R.L.038-2017-GOREMAD/GGR08/09/2017182,904.00182,904.00",
2194019,280701,28/11/2013,"AMPLIACION, MEJORAMIENTO DEL SERVICIO DE AGUA POTABLE Y SANEAMIENTO DEL DISTRITO DE LABERINTO - TAMBOPATA - MADRE DE DIOS",ACTIVO,PROYECTO DE INVERSION,NO,OPMI DE LA MUNICIPALIDAD DISTRITAL DE LABERINTO,UF DE LA MUNICIPALIDAD DISTRITAL DE LABERINTO,UEI DE LA MUNICIPALIDAD DISTRITAL DE LABERINTO,VIABLE,NO,SANEAMIENTO - SANEAMIENTO - SANEAMIENTO RURAL,27/06/2014,"9,027,467.00","3,295",SI,SI,09/08/2017,07/10/2022,"11,224,839.15",0.00,0.00,"11,224,839.15","11,224,839.15","10,773,948.09",96 %,"450,891.06",AGO-2015,AGO-2020,"1CONTRATACION PARA LA EJECUCION DE OBRA PARA LA SUPERVISION DE LA OBRA DEL PROYECTO DE AMPLIACION, MEJORAMIENTO DEL SISTEMA DE AGUA POTABLE Y SANEAMIENTO DEL DISTRITO DE LABERINTO - TAMBOPATA - MADRE DE DIOSCONSORCIO SAGITARIOCONTRATO DE LA EJECUCION DE OBRA N°001-2017-MDL17/07/20179,971,312.009,971,312.00","1CONTRATACION DE SERVICIO DE CONSULTORIA DE OBRA PARA LA SUPERVISION DE LA OBRA DEL PROYECTO DE AMPLIACION, MEJORAMIENTO DEL SISTEMA DE AGUA POTABLE Y SANEAMIENTO DEL DISTRITO DE LABERINTO - TAMBOPATA - MADRE DE DIOSCONSORCIO ROSARIOSupervision de Obra 001-2017-MDL14/07/2017500,000.00500,000.00",,
2194085,255909,08/04/2013,CONSOLIDACION DEL SISTEMA DE INNOVACION AGRARIA,CERRADO,PROYECTO DE INVERSION,NO,OPMI DEL MINISTERIO DE AGRICULTURA - MINAG,OFICINA DE PLANEAMIENTO Y PRESUPUESTO,UEI PROGRAMA NACIONAL DE INNOVACION AGRARIA - PNIA,VIABLE,NO,"PLANEAMIENTO, GESTIÓN Y RESERVA DE CONTINGENCIA - CIENCIA Y TECNOLOGÍA - INNOVACIÓN TECNOLÓGICA",30/10/2013,"229,599,104.00","1,244,505",SI,SI,01/06/2015,31/05/2021,"229,599,104.00",0.00,0.00,"229,599,104.00","229,599,104.00","217,386,058.07",94.7 %,"12,213,045.93",MAY-2015,MAY-2021,,,"1CAMPANA EXTRACTORA DE GASESTAWA S A040-201821/12/201844,988.0044,988.001SOFTWARE PARA ALINEAMIENTO DE SECUENCIA DE ADNCODONCODE CORPORATION72517/10/20182,805.002,805.001COMPRA DE ENZIMA CELLILASE DE 500000 U/G	 SHANDONG YUEXIANG GROUP CO., LIMITEDOC 50 - PROYECTO 10-2016-INIA15/03/201810,850.0010,850.001ADQUISICION DE 02 SOFTWARE VERSION 4.5 FOR WINDOWSINFOMETRIX, INCOC 036-2018 - PROYECTO 022-2015-INIA22/02/20186,300.006,300.001ADQUISICION DE EQUIPOS PARA LA IMPLEMENTACION DEL POYECTO DE INVESTIGACION ""CONSTRUCCION DE NOVEDOSOS EQUIPOS PARA EL ESTUDIO DE FIBRAS,LANAS, PELOS Y PIEL DE ANIMALES: SU IMPACTO EN EL MEJORAMIENTO GENETICO Y CONSERVACION DE CAMELIDOS SUDAMERICANOSOPERACIONES VALDIVIA S.A.C.002-201827/02/2018101,857.00101,857.00","1SERVICIO TECNOLOGICO PARA EL GENOTIPADO DE POLIMORFISMO DE NUCLEOTIDO SIMPLE (PNS) EN AUQUENIDOS USANDO UNA MICROMATRIZ DE PNSSNEOGEN LATINOAMERICA SAPI DE CVOS 21 - CONT 028-2016-INIA-PNIA12/11/2019322,560.00322,560.001SERVICIOS DE DIFUSIÓN DEL PROYECTO EN PORTAL WEBUNIVERSIDAD ESTATAL DE CAROLINA DEL NORTE028-INIA-CT10-201502/07/201932,000.0032,000.001SERVICIOS DE DIFUSION DEL PROYECTO EN PORTAL WEB DE LA UNIVERSIDAD ESTATAL DE CAROLINA DEL NORTE (NCSU)NC STATE TREASURER - NCSU EFT CLEARING ACCOUNTOS 28-PROYECTO 10INIA201527/06/201932,000.0032,000.001PUBLICACIÓN DE ARTÍCULOS CIENTÍFICOS EN REVISTA INDEXADA INTERNACIONALPUBLIC LIBRARY OF SCIENCE69206/06/20194,785.004,785.001SERVICIO DE CONSULTORIA PARA REALIZAR TALLER DE CAPACITACIÓN EN TOLERANCIA AL ESTRÉS ABIÓTICO.MARIA CARIDAD GONZALEZ CEPERO020 - CONTRATO 014-2015-INIA17/04/201914,000.0014,000.001SERVICIO DE CONSULTORIA PARA REALIZAR REUNIÓN INTERNACIONAL DE CAFE DENTRO DEL PROYECTO ""FLORISTICA Y ECOLOGÍA DE LAS ESPECIES ARVENSES ASOCIADAS AL CULTIVO DE CAFÉ EN LA SELVA CENTRAL DEL PERU""OLIVEIRO GUERREIRO FILHOOS 06-2019-CONTRATO 011-2016-INIA02/04/201923,200.0023,200.001SERVICIO DE ANÁLISISBRIGHAM YOUNG UNIVERSITYSERVICIO DE ANALISIS07/03/201912,400.0012,400.001SERVICIO DE ASESORIA EN ESTRATEGIAS DE CONTROL BIOLOGICO PARA EL PROYECTO ""IMPLEMENTACION DE TECNICAS DE AGRICULTURA RESIDUO CERO PARA LA SUSTENTABILIDAD DE LOS PRODUCTORES DE UVA EN LA REGION ICAKOPPERT ESPAÑA SL289-2019-ITP08/02/201930,000.0030,000.001SERVICIO ESPECIALIZADO PARA BRINDAR ASESORÍA SOBRE MECANISMOS DE APORTES DE GENES DE PARIENTES SILVESTRES A LA DIVERSIDAD DENTRO DE CULTIVO DE TUBEROSAS CULTIVASRAFAEL ANGEL SAG CORAZON ORTEGA PACZKA1247-CONTRATO 027-201-INIA16/11/20185,873.005,873.001SERVICIO DE CONSULTORIA DE UN EXPERTO DEL 03 AL 07 DE DICIEMBRE DE 2018IWONA MARTA SZAREJKO1108-CONTRATO14-2015INIA16/10/201814,000.0014,000.001SERVICIO DE CONSULTORIA EN LOS CAMPUS DE LA UNALMLUIS ENRIQUE RODRIGUEZ SAONA035-contrato022-2015-inia27/09/20187,490.007,490.001SERVICIO DE CONSULTORÍA DE UN EXPERTO EXTRANJERO PARA EL CURSO INTERNACIONAL TÓPICOS ESPECIALES PARA EL MANEJO DE MALEZASPEDRO LUIS DA COSTA AGUIAR ALVES872-CONTRATO011-2016-INIA05/09/201825,000.0025,000.001SERVICIO DE CONSULTORIA DE CONSTRUCCION DEL MARCO CONCEPTUAL DE LOS MODELOS DE DEGRACION DE PASTIZALJOHN DAVID ALL0727-CONTRATO 032-2015-INIA09/08/20184,800.004,800.001SERVICIO TECNOLOGICO PARA LA PREPARACION DE BIBLIOTECA REDUCIDAS DE ADN, SECUENCIAMIENTO Y SOPORTE PARA ANALISIS BIOINFORMATICO PARA IDENTIFICACION DE POLIMORFISMOS DE NUCLEOTIDOS SIMPLES (PNS) EN ALPACASAGRESEARCH LIMITED AT HAMILTON, NEW ZEALAND (AGRESEARCH)OS 392-PROYECTO 028-2016-INIA25/05/201888,323.0088,323.001PAGO POR INSCRIPCION AL III CONGRESO NACIONAL DE VIAS PECUARIAS Y TRASHUMANCIASOCIEDAD ESPAÑOLA PARA EL ESTUDIO DE LOS PASTOS347-CONTRATO019 -2015-INIA20/04/20181,680.001,680.001SERVICIO DE SECUENCIAMIENTO BIDIRECCIONAL Y EDICION MANUAL  PARA MICROPLACA DE 384 MUESTRAS PARA PROYECTO PINIACANADIAN CENTRE FOR DNA BARCODING OF THE UNIVERSITY OF GUELPH66712/04/201861,560.0061,560.001SERVICIO DE INSCRIPCIÓN A LA XIII CONFERENCIA INTERNACIONAL DE ARROZ PARA AMÉRICA LATINA Y EL CARIBEGABRIELA ROHR1226/03/20181,400.001,400.001SERVICIO DE ANALISIS DE GENOTIPICACION DEL MATERIAL GENERTICO EVALUADO EN EL PROYECTO, EMPLEANDO MARCADORES MOLECULARESDATA2BIO, LLC189-PROYECTO 014-2015-INIA13/03/201825,200.0025,200.001SERVICIO DE CONSULTORIA DE UN EXPERTOEN LA MEDICION DE GASES DE EFECTO INVERNADERO PARA CAPACITAR AL EQUIPO TECNICOSARA IVONNE HUBE SANTANAOS 118-2018-PROYECTO 015INIA-201522/02/20188,500.008,500.001SERVICIO DE ANALSIS DE GASES DE EFECTO INVERNADERO EN MUESTRAS DE AIRE, INCLUYE VIALES, SEPTAS Y ENSAMBLADO Y CARGOS DE ADUANAINSTITUTO DE INVESTIGACIONES AGROPECUARIAS001-2018-INTER16/02/20188,883.008,883.00"
